tcpdump: verbose output suppressed, use -v or -vv for full protocol decode
listening on eth0, link-type EN10MB (Ethernet), capture size 262144 bytes
15:42:55.700238 IP 198.96.85.104.53032 > lamp-s-1vcpu-1gb-tor1-01.ssh: Flags [.], ack 4046422562, win 1022, length 0
15:42:55.702736 IP lamp-s-1vcpu-1gb-tor1-01.ssh > 198.96.85.104.53032: Flags [P.], seq 1:109, ack 0, win 295, length 108
15:42:55.702849 IP lamp-s-1vcpu-1gb-tor1-01.ssh > 198.96.85.104.53032: Flags [P.], seq 109:145, ack 0, win 295, length 36
15:42:55.702957 IP lamp-s-1vcpu-1gb-tor1-01.ssh > 198.96.85.104.53032: Flags [P.], seq 145:253, ack 0, win 295, length 108
15:42:55.703036 IP lamp-s-1vcpu-1gb-tor1-01.ssh > 198.96.85.104.53032: Flags [P.], seq 253:289, ack 0, win 295, length 36
15:42:55.703537 IP 198.96.85.104.53032 > lamp-s-1vcpu-1gb-tor1-01.ssh: Flags [.], ack 145, win 1022, length 0
15:42:55.703614 IP 198.96.85.104.53032 > lamp-s-1vcpu-1gb-tor1-01.ssh: Flags [.], ack 289, win 1021, length 0
15:42:58.739474 IP lamp-s-1vcpu-1gb-tor1-01.ssh > 198.96.85.104.53032: Flags [P.], seq 289:1157, ack 0, win 295, length 868
15:42:58.739676 IP lamp-s-1vcpu-1gb-tor1-01.ssh > 198.96.85.104.53032: Flags [P.], seq 1157:1321, ack 0, win 295, length 164
15:42:58.739840 IP lamp-s-1vcpu-1gb-tor1-01.ssh > 198.96.85.104.53032: Flags [P.], seq 1321:1485, ack 0, win 295, length 164
15:42:58.739960 IP lamp-s-1vcpu-1gb-tor1-01.ssh > 198.96.85.104.53032: Flags [P.], seq 1485:1649, ack 0, win 295, length 164
15:42:58.740072 IP lamp-s-1vcpu-1gb-tor1-01.ssh > 198.96.85.104.53032: Flags [P.], seq 1649:1813, ack 0, win 295, length 164
15:42:58.740233 IP lamp-s-1vcpu-1gb-tor1-01.ssh > 198.96.85.104.53032: Flags [P.], seq 1813:1977, ack 0, win 295, length 164
15:42:58.740345 IP lamp-s-1vcpu-1gb-tor1-01.ssh > 198.96.85.104.53032: Flags [P.], seq 1977:2141, ack 0, win 295, length 164
15:42:58.740427 IP 198.96.85.104.53032 > lamp-s-1vcpu-1gb-tor1-01.ssh: Flags [.], ack 1321, win 1024, length 0
15:42:58.740476 IP lamp-s-1vcpu-1gb-tor1-01.ssh > 198.96.85.104.53032: Flags [P.], seq 2141:2177, ack 0, win 295, length 36
15:42:58.740582 IP lamp-s-1vcpu-1gb-tor1-01.ssh > 198.96.85.104.53032: Flags [P.], seq 2177:2341, ack 0, win 295, length 164
15:42:58.740659 IP lamp-s-1vcpu-1gb-tor1-01.ssh > 198.96.85.104.53032: Flags [P.], seq 2341:2377, ack 0, win 295, length 36
15:42:58.740748 IP 198.96.85.104.53032 > lamp-s-1vcpu-1gb-tor1-01.ssh: Flags [.], ack 1649, win 1022, length 0
15:42:58.740793 IP lamp-s-1vcpu-1gb-tor1-01.ssh > 198.96.85.104.53032: Flags [P.], seq 2377:2525, ack 0, win 295, length 148
20 packets captured
57 packets received by filter
31 packets dropped by kernel