04:16:46.517349 IP toroon0247w-lp130-11-184-148-73-232.dsl.bell.ca.50361 > lamp-s-1vcpu-1gb-tor1-01.ssh: Flags [.], ack 182032592, win 1026, length 0
04:16:46.517426 IP lamp-s-1vcpu-1gb-tor1-01.ssh > toroon0247w-lp130-11-184-148-73-232.dsl.bell.ca.50361: Flags [P.], seq 182036804:182037168, ack 113721, win 319, length 364
04:16:46.517482 IP toroon0247w-lp130-11-184-148-73-232.dsl.bell.ca.50361 > lamp-s-1vcpu-1gb-tor1-01.ssh: Flags [.], ack 182033228, win 1024, length 0
04:16:46.517561 IP lamp-s-1vcpu-1gb-tor1-01.ssh > toroon0247w-lp130-11-184-148-73-232.dsl.bell.ca.50361: Flags [P.], seq 182037168:182037532, ack 113721, win 319, length 364
04:16:46.517641 IP lamp-s-1vcpu-1gb-tor1-01.ssh > toroon0247w-lp130-11-184-148-73-232.dsl.bell.ca.50361: Flags [P.], seq 182037532:182037744, ack 113721, win 319, length 212
04:16:46.517719 IP toroon0247w-lp130-11-184-148-73-232.dsl.bell.ca.50361 > lamp-s-1vcpu-1gb-tor1-01.ssh: Flags [.], ack 182033956, win 1021, length 0
04:16:46.517770 IP lamp-s-1vcpu-1gb-tor1-01.ssh > toroon0247w-lp130-11-184-148-73-232.dsl.bell.ca.50361: Flags [P.], seq 182037744:182037956, ack 113721, win 319, length 212
04:16:46.517839 IP toroon0247w-lp130-11-184-148-73-232.dsl.bell.ca.50361 > lamp-s-1vcpu-1gb-tor1-01.ssh: Flags [.], ack 182034532, win 1026, length 0
04:16:46.517872 IP lamp-s-1vcpu-1gb-tor1-01.ssh > toroon0247w-lp130-11-184-148-73-232.dsl.bell.ca.50361: Flags [P.], seq 182037956:182038320, ack 113721, win 319, length 364
04:16:46.517963 IP toroon0247w-lp130-11-184-148-73-232.dsl.bell.ca.50361 > lamp-s-1vcpu-1gb-tor1-01.ssh: Flags [.], ack 182034956, win 1024, length 0
04:16:46.518026 IP lamp-s-1vcpu-1gb-tor1-01.ssh > toroon0247w-lp130-11-184-148-73-232.dsl.bell.ca.50361: Flags [P.], seq 182038320:182038684, ack 113721, win 319, length 364
04:16:46.518098 IP lamp-s-1vcpu-1gb-tor1-01.ssh > toroon0247w-lp130-11-184-148-73-232.dsl.bell.ca.50361: Flags [P.], seq 182038684:182038872, ack 113721, win 319, length 188
04:16:46.518166 IP lamp-s-1vcpu-1gb-tor1-01.ssh > toroon0247w-lp130-11-184-148-73-232.dsl.bell.ca.50361: Flags [P.], seq 182038872:182039084, ack 113721, win 319, length 212
04:16:46.518221 IP toroon0247w-lp130-11-184-148-73-232.dsl.bell.ca.50361 > lamp-s-1vcpu-1gb-tor1-01.ssh: Flags [.], ack 182035380, win 1023, length 0
04:16:46.518295 IP lamp-s-1vcpu-1gb-tor1-01.ssh > toroon0247w-lp130-11-184-148-73-232.dsl.bell.ca.50361: Flags [P.], seq 182039084:182039296, ack 113721, win 319, length 212
04:16:46.518342 IP toroon0247w-lp130-11-184-148-73-232.dsl.bell.ca.50361 > lamp-s-1vcpu-1gb-tor1-01.ssh: Flags [.], ack 182035956, win 1021, length 0
04:16:46.518415 IP lamp-s-1vcpu-1gb-tor1-01.ssh > toroon0247w-lp130-11-184-148-73-232.dsl.bell.ca.50361: Flags [P.], seq 182039296:182039660, ack 113721, win 319, length 364
04:16:46.518493 IP lamp-s-1vcpu-1gb-tor1-01.ssh > toroon0247w-lp130-11-184-148-73-232.dsl.bell.ca.50361: Flags [P.], seq 182039660:182040024, ack 113721, win 319, length 364
04:16:46.518580 IP lamp-s-1vcpu-1gb-tor1-01.ssh > toroon0247w-lp130-11-184-148-73-232.dsl.bell.ca.50361: Flags [P.], seq 182040024:182040236, ack 113721, win 319, length 212
04:16:46.518652 IP lamp-s-1vcpu-1gb-tor1-01.ssh > toroon0247w-lp130-11-184-148-73-232.dsl.bell.ca.50361: Flags [P.], seq 182040236:182040448, ack 113721, win 319, length 212
04:16:46.518719 IP lamp-s-1vcpu-1gb-tor1-01.ssh > toroon0247w-lp130-11-184-148-73-232.dsl.bell.ca.50361: Flags [P.], seq 182040448:182040660, ack 113721, win 319, length 212
04:16:46.518788 IP lamp-s-1vcpu-1gb-tor1-01.ssh > toroon0247w-lp130-11-184-148-73-232.dsl.bell.ca.50361: Flags [P.], seq 182040660:182040872, ack 113721, win 319, length 212
04:16:46.518819 IP lamp-s-1vcpu-1gb-tor1-01.ssh > toroon0247w-lp130-11-184-148-73-232.dsl.bell.ca.50361: Flags [P.], seq 182040872:182041084, ack 113721, win 319, length 212
04:16:46.518852 IP toroon0247w-lp130-11-184-148-73-232.dsl.bell.ca.50361 > lamp-s-1vcpu-1gb-tor1-01.ssh: Flags [.], ack 182036592, win 1026, length 0
04:16:46.518965 IP toroon0247w-lp130-11-184-148-73-232.dsl.bell.ca.50361 > lamp-s-1vcpu-1gb-tor1-01.ssh: Flags [.], ack 182036804, win 1025, length 0
04:16:46.518978 IP lamp-s-1vcpu-1gb-tor1-01.ssh > toroon0247w-lp130-11-184-148-73-232.dsl.bell.ca.50361: Flags [P.], seq 182041084:182041624, ack 113721, win 319, length 540
04:16:46.519075 IP lamp-s-1vcpu-1gb-tor1-01.ssh > toroon0247w-lp130-11-184-148-73-232.dsl.bell.ca.50361: Flags [P.], seq 182041624:182041988, ack 113721, win 319, length 364
04:16:46.519094 IP toroon0247w-lp130-11-184-148-73-232.dsl.bell.ca.50361 > lamp-s-1vcpu-1gb-tor1-01.ssh: Flags [.], ack 182037532, win 1022, length 0
04:16:46.519184 IP lamp-s-1vcpu-1gb-tor1-01.ssh > toroon0247w-lp130-11-184-148-73-232.dsl.bell.ca.50361: Flags [P.], seq 182041988:182042352, ack 113721, win 319, length 364
04:16:46.519275 IP lamp-s-1vcpu-1gb-tor1-01.ssh > toroon0247w-lp130-11-184-148-73-232.dsl.bell.ca.50361: Flags [P.], seq 182042352:182042564, ack 113721, win 319, length 212
04:16:46.519353 IP toroon0247w-lp130-11-184-148-73-232.dsl.bell.ca.50361 > lamp-s-1vcpu-1gb-tor1-01.ssh: Flags [.], ack 182037956, win 1021, length 0
04:16:46.519368 IP toroon0247w-lp130-11-184-148-73-232.dsl.bell.ca.50361 > lamp-s-1vcpu-1gb-tor1-01.ssh: Flags [.], ack 182038684, win 1026, length 0
04:16:46.519409 IP lamp-s-1vcpu-1gb-tor1-01.ssh > toroon0247w-lp130-11-184-148-73-232.dsl.bell.ca.50361: Flags [P.], seq 182042564:182042776, ack 113721, win 319, length 212
04:16:46.519461 IP toroon0247w-lp130-11-184-148-73-232.dsl.bell.ca.50361 > lamp-s-1vcpu-1gb-tor1-01.ssh: Flags [.], ack 182039084, win 1025, length 0
04:16:46.519583 IP lamp-s-1vcpu-1gb-tor1-01.ssh > toroon0247w-lp130-11-184-148-73-232.dsl.bell.ca.50361: Flags [P.], seq 182042776:182043444, ack 113721, win 319, length 668
04:16:46.519665 IP lamp-s-1vcpu-1gb-tor1-01.ssh > toroon0247w-lp130-11-184-148-73-232.dsl.bell.ca.50361: Flags [P.], seq 182043444:182043656, ack 113721, win 319, length 212
04:16:46.519783 IP lamp-s-1vcpu-1gb-tor1-01.ssh > toroon0247w-lp130-11-184-148-73-232.dsl.bell.ca.50361: Flags [P.], seq 182043656:182043868, ack 113721, win 319, length 212
04:16:46.519855 IP toroon0247w-lp130-11-184-148-73-232.dsl.bell.ca.50361 > lamp-s-1vcpu-1gb-tor1-01.ssh: Flags [.], ack 182039660, win 1022, length 0
04:16:46.519871 IP toroon0247w-lp130-11-184-148-73-232.dsl.bell.ca.50361 > lamp-s-1vcpu-1gb-tor1-01.ssh: Flags [.], ack 182040236, win 1026, length 0
04:16:46.519972 IP lamp-s-1vcpu-1gb-tor1-01.ssh > toroon0247w-lp130-11-184-148-73-232.dsl.bell.ca.50361: Flags [P.], seq 182043868:182044384, ack 113721, win 319, length 516
04:16:46.520060 IP lamp-s-1vcpu-1gb-tor1-01.ssh > toroon0247w-lp130-11-184-148-73-232.dsl.bell.ca.50361: Flags [P.], seq 182044384:182044596, ack 113721, win 319, length 212
04:16:46.520085 IP toroon0247w-lp130-11-184-148-73-232.dsl.bell.ca.50361 > lamp-s-1vcpu-1gb-tor1-01.ssh: Flags [.], ack 182040660, win 1024, length 0
04:16:46.520177 IP lamp-s-1vcpu-1gb-tor1-01.ssh > toroon0247w-lp130-11-184-148-73-232.dsl.bell.ca.50361: Flags [P.], seq 182044596:182044960, ack 113721, win 319, length 364
04:16:46.520224 IP toroon0247w-lp130-11-184-148-73-232.dsl.bell.ca.50361 > lamp-s-1vcpu-1gb-tor1-01.ssh: Flags [.], ack 182041084, win 1023, length 0
04:16:46.520306 IP lamp-s-1vcpu-1gb-tor1-01.ssh > toroon0247w-lp130-11-184-148-73-232.dsl.bell.ca.50361: Flags [P.], seq 182044960:182045324, ack 113721, win 319, length 364
04:16:46.520385 IP lamp-s-1vcpu-1gb-tor1-01.ssh > toroon0247w-lp130-11-184-148-73-232.dsl.bell.ca.50361: Flags [P.], seq 182045324:182045536, ack 113721, win 319, length 212
04:16:46.520459 IP lamp-s-1vcpu-1gb-tor1-01.ssh > toroon0247w-lp130-11-184-148-73-232.dsl.bell.ca.50361: Flags [P.], seq 182045536:182045748, ack 113721, win 319, length 212
04:16:46.520532 IP lamp-s-1vcpu-1gb-tor1-01.ssh > toroon0247w-lp130-11-184-148-73-232.dsl.bell.ca.50361: Flags [P.], seq 182045748:182045960, ack 113721, win 319, length 212
04:16:46.520611 IP toroon0247w-lp130-11-184-148-73-232.dsl.bell.ca.50361 > lamp-s-1vcpu-1gb-tor1-01.ssh: Flags [.], ack 182041988, win 1026, length 0
04:16:46.520623 IP lamp-s-1vcpu-1gb-tor1-01.ssh > toroon0247w-lp130-11-184-148-73-232.dsl.bell.ca.50361: Flags [P.], seq 182045960:182046172, ack 113721, win 319, length 212
04:16:46.520717 IP lamp-s-1vcpu-1gb-tor1-01.ssh > toroon0247w-lp130-11-184-148-73-232.dsl.bell.ca.50361: Flags [P.], seq 182046172:182046536, ack 113721, win 319, length 364
04:16:46.520792 IP lamp-s-1vcpu-1gb-tor1-01.ssh > toroon0247w-lp130-11-184-148-73-232.dsl.bell.ca.50361: Flags [P.], seq 182046536:182046748, ack 113721, win 319, length 212
04:16:46.520865 IP lamp-s-1vcpu-1gb-tor1-01.ssh > toroon0247w-lp130-11-184-148-73-232.dsl.bell.ca.50361: Flags [P.], seq 182046748:182046960, ack 113721, win 319, length 212
04:16:46.520937 IP lamp-s-1vcpu-1gb-tor1-01.ssh > toroon0247w-lp130-11-184-148-73-232.dsl.bell.ca.50361: Flags [P.], seq 182046960:182047172, ack 113721, win 319, length 212
04:16:46.521009 IP lamp-s-1vcpu-1gb-tor1-01.ssh > toroon0247w-lp130-11-184-148-73-232.dsl.bell.ca.50361: Flags [P.], seq 182047172:182047384, ack 113721, win 319, length 212
04:16:46.521081 IP lamp-s-1vcpu-1gb-tor1-01.ssh > toroon0247w-lp130-11-184-148-73-232.dsl.bell.ca.50361: Flags [P.], seq 182047384:182047596, ack 113721, win 319, length 212
04:16:46.521183 IP lamp-s-1vcpu-1gb-tor1-01.ssh > toroon0247w-lp130-11-184-148-73-232.dsl.bell.ca.50361: Flags [P.], seq 182047596:182047808, ack 113721, win 319, length 212
04:16:46.521213 IP toroon0247w-lp130-11-184-148-73-232.dsl.bell.ca.50361 > lamp-s-1vcpu-1gb-tor1-01.ssh: Flags [.], ack 182043868, win 1026, length 0
04:16:46.521369 IP lamp-s-1vcpu-1gb-tor1-01.ssh > toroon0247w-lp130-11-184-148-73-232.dsl.bell.ca.50361: Flags [P.], seq 182047808:182048172, ack 113721, win 319, length 364
04:16:46.521504 IP lamp-s-1vcpu-1gb-tor1-01.ssh > toroon0247w-lp130-11-184-148-73-232.dsl.bell.ca.50361: Flags [P.], seq 182048172:182048384, ack 113721, win 319, length 212
04:16:46.521610 IP lamp-s-1vcpu-1gb-tor1-01.ssh > toroon0247w-lp130-11-184-148-73-232.dsl.bell.ca.50361: Flags [P.], seq 182048384:182048596, ack 113721, win 319, length 212
04:16:46.521690 IP lamp-s-1vcpu-1gb-tor1-01.ssh > toroon0247w-lp130-11-184-148-73-232.dsl.bell.ca.50361: Flags [P.], seq 182048596:182048808, ack 113721, win 319, length 212
04:16:46.521764 IP lamp-s-1vcpu-1gb-tor1-01.ssh > toroon0247w-lp130-11-184-148-73-232.dsl.bell.ca.50361: Flags [P.], seq 182048808:182049020, ack 113721, win 319, length 212
04:16:46.521837 IP lamp-s-1vcpu-1gb-tor1-01.ssh > toroon0247w-lp130-11-184-148-73-232.dsl.bell.ca.50361: Flags [P.], seq 182049020:182049232, ack 113721, win 319, length 212
04:16:46.521909 IP lamp-s-1vcpu-1gb-tor1-01.ssh > toroon0247w-lp130-11-184-148-73-232.dsl.bell.ca.50361: Flags [P.], seq 182049232:182049444, ack 113721, win 319, length 212
04:16:46.521982 IP toroon0247w-lp130-11-184-148-73-232.dsl.bell.ca.50361 > lamp-s-1vcpu-1gb-tor1-01.ssh: Flags [.], ack 182045960, win 1026, length 0
04:16:46.522048 IP lamp-s-1vcpu-1gb-tor1-01.ssh > toroon0247w-lp130-11-184-148-73-232.dsl.bell.ca.50361: Flags [P.], seq 182049444:182049656, ack 113721, win 319, length 212
04:16:46.522126 IP lamp-s-1vcpu-1gb-tor1-01.ssh > toroon0247w-lp130-11-184-148-73-232.dsl.bell.ca.50361: Flags [P.], seq 182049656:182049844, ack 113721, win 319, length 188
04:16:46.522175 IP lamp-s-1vcpu-1gb-tor1-01.ssh > toroon0247w-lp130-11-184-148-73-232.dsl.bell.ca.50361: Flags [P.], seq 182049844:182050056, ack 113721, win 319, length 212
04:16:46.522358 IP toroon0247w-lp130-11-184-148-73-232.dsl.bell.ca.50361 > lamp-s-1vcpu-1gb-tor1-01.ssh: Flags [.], ack 182046536, win 1024, length 0
04:16:46.522373 IP toroon0247w-lp130-11-184-148-73-232.dsl.bell.ca.50361 > lamp-s-1vcpu-1gb-tor1-01.ssh: Flags [.], ack 182046748, win 1023, length 0
04:16:46.522377 IP toroon0247w-lp130-11-184-148-73-232.dsl.bell.ca.50361 > lamp-s-1vcpu-1gb-tor1-01.ssh: Flags [.], ack 182047172, win 1021, length 0
04:16:46.522385 IP lamp-s-1vcpu-1gb-tor1-01.ssh > toroon0247w-lp130-11-184-148-73-232.dsl.bell.ca.50361: Flags [P.], seq 182050056:182050444, ack 113721, win 319, length 388
04:16:46.522593 IP toroon0247w-lp130-11-184-148-73-232.dsl.bell.ca.50361 > lamp-s-1vcpu-1gb-tor1-01.ssh: Flags [.], ack 182047596, win 1026, length 0
04:16:46.522655 IP lamp-s-1vcpu-1gb-tor1-01.ssh > toroon0247w-lp130-11-184-148-73-232.dsl.bell.ca.50361: Flags [P.], seq 182050444:182051112, ack 113721, win 319, length 668
04:16:46.522826 IP lamp-s-1vcpu-1gb-tor1-01.ssh > toroon0247w-lp130-11-184-148-73-232.dsl.bell.ca.50361: Flags [P.], seq 182051112:182051476, ack 113721, win 319, length 364
04:16:46.522857 IP toroon0247w-lp130-11-184-148-73-232.dsl.bell.ca.50361 > lamp-s-1vcpu-1gb-tor1-01.ssh: Flags [P.], seq 113721:113757, ack 182047808, win 1025, length 36
04:16:46.522974 IP toroon0247w-lp130-11-184-148-73-232.dsl.bell.ca.50361 > lamp-s-1vcpu-1gb-tor1-01.ssh: Flags [.], ack 182048384, win 1023, length 0
