04:30:35.856466 IP lamp-s-1vcpu-1gb-tor1-01.ssh > toroon0247w-lp130-11-184-148-73-232.dsl.bell.ca.50501: Flags [P.], seq 1912696:1913052, ack 1189, win 319, length 356
04:30:35.856538 IP lamp-s-1vcpu-1gb-tor1-01.ssh > toroon0247w-lp130-11-184-148-73-232.dsl.bell.ca.50501: Flags [P.], seq 1913052:1913256, ack 1189, win 319, length 204
04:30:35.856606 IP lamp-s-1vcpu-1gb-tor1-01.ssh > toroon0247w-lp130-11-184-148-73-232.dsl.bell.ca.50501: Flags [P.], seq 1913256:1913460, ack 1189, win 319, length 204
04:30:35.856680 IP toroon0247w-lp130-11-184-148-73-232.dsl.bell.ca.50501 > lamp-s-1vcpu-1gb-tor1-01.ssh: Flags [.], ack 1909164, win 1022, length 0
04:30:35.856728 IP lamp-s-1vcpu-1gb-tor1-01.ssh > toroon0247w-lp130-11-184-148-73-232.dsl.bell.ca.50501: Flags [P.], seq 1913460:1913664, ack 1189, win 319, length 204
04:30:35.856800 IP lamp-s-1vcpu-1gb-tor1-01.ssh > toroon0247w-lp130-11-184-148-73-232.dsl.bell.ca.50501: Flags [P.], seq 1913664:1913868, ack 1189, win 319, length 204
04:30:35.856876 IP lamp-s-1vcpu-1gb-tor1-01.ssh > toroon0247w-lp130-11-184-148-73-232.dsl.bell.ca.50501: Flags [P.], seq 1913868:1914224, ack 1189, win 319, length 356
04:30:35.856948 IP toroon0247w-lp130-11-184-148-73-232.dsl.bell.ca.50501 > lamp-s-1vcpu-1gb-tor1-01.ssh: Flags [.], ack 1910224, win 1026, length 0
04:30:35.857005 IP lamp-s-1vcpu-1gb-tor1-01.ssh > toroon0247w-lp130-11-184-148-73-232.dsl.bell.ca.50501: Flags [P.], seq 1914224:1914428, ack 1189, win 319, length 204
04:30:35.857062 IP toroon0247w-lp130-11-184-148-73-232.dsl.bell.ca.50501 > lamp-s-1vcpu-1gb-tor1-01.ssh: Flags [.], ack 1910428, win 1025, length 0
04:30:35.857487 IP lamp-s-1vcpu-1gb-tor1-01.ssh > toroon0247w-lp130-11-184-148-73-232.dsl.bell.ca.50501: Flags [P.], seq 1914428:1914784, ack 1189, win 319, length 356
04:30:35.857520 IP toroon0247w-lp130-11-184-148-73-232.dsl.bell.ca.50501 > lamp-s-1vcpu-1gb-tor1-01.ssh: Flags [.], ack 1910836, win 1024, length 0
04:30:35.857550 IP toroon0247w-lp130-11-184-148-73-232.dsl.bell.ca.50501 > lamp-s-1vcpu-1gb-tor1-01.ssh: Flags [.], ack 1911752, win 1026, length 0
04:30:35.857650 IP lamp-s-1vcpu-1gb-tor1-01.ssh > toroon0247w-lp130-11-184-148-73-232.dsl.bell.ca.50501: Flags [P.], seq 1914784:1915140, ack 1189, win 319, length 356
04:30:35.857670 IP toroon0247w-lp130-11-184-148-73-232.dsl.bell.ca.50501 > lamp-s-1vcpu-1gb-tor1-01.ssh: Flags [.], ack 1911956, win 1025, length 0
04:30:35.857789 IP lamp-s-1vcpu-1gb-tor1-01.ssh > toroon0247w-lp130-11-184-148-73-232.dsl.bell.ca.50501: Flags [P.], seq 1915140:1915648, ack 1189, win 319, length 508
04:30:35.857807 IP toroon0247w-lp130-11-184-148-73-232.dsl.bell.ca.50501 > lamp-s-1vcpu-1gb-tor1-01.ssh: Flags [.], ack 1912492, win 1023, length 0
04:30:35.857898 IP lamp-s-1vcpu-1gb-tor1-01.ssh > toroon0247w-lp130-11-184-148-73-232.dsl.bell.ca.50501: Flags [P.], seq 1915648:1916004, ack 1189, win 319, length 356
04:30:35.857942 IP toroon0247w-lp130-11-184-148-73-232.dsl.bell.ca.50501 > lamp-s-1vcpu-1gb-tor1-01.ssh: Flags [.], ack 1913256, win 1026, length 0
04:30:35.857954 IP toroon0247w-lp130-11-184-148-73-232.dsl.bell.ca.50501 > lamp-s-1vcpu-1gb-tor1-01.ssh: Flags [.], ack 1913460, win 1025, length 0
04:30:35.858050 IP lamp-s-1vcpu-1gb-tor1-01.ssh > toroon0247w-lp130-11-184-148-73-232.dsl.bell.ca.50501: Flags [P.], seq 1916004:1916360, ack 1189, win 319, length 356
04:30:35.858146 IP lamp-s-1vcpu-1gb-tor1-01.ssh > toroon0247w-lp130-11-184-148-73-232.dsl.bell.ca.50501: Flags [P.], seq 1916360:1916868, ack 1189, win 319, length 508
04:30:35.858244 IP lamp-s-1vcpu-1gb-tor1-01.ssh > toroon0247w-lp130-11-184-148-73-232.dsl.bell.ca.50501: Flags [P.], seq 1916868:1917072, ack 1189, win 319, length 204
04:30:35.858306 IP toroon0247w-lp130-11-184-148-73-232.dsl.bell.ca.50501 > lamp-s-1vcpu-1gb-tor1-01.ssh: Flags [.], ack 1913868, win 1024, length 0
04:30:35.858375 IP lamp-s-1vcpu-1gb-tor1-01.ssh > toroon0247w-lp130-11-184-148-73-232.dsl.bell.ca.50501: Flags [P.], seq 1917072:1917276, ack 1189, win 319, length 204
04:30:35.858454 IP lamp-s-1vcpu-1gb-tor1-01.ssh > toroon0247w-lp130-11-184-148-73-232.dsl.bell.ca.50501: Flags [P.], seq 1917276:1917632, ack 1189, win 319, length 356
04:30:35.858524 IP lamp-s-1vcpu-1gb-tor1-01.ssh > toroon0247w-lp130-11-184-148-73-232.dsl.bell.ca.50501: Flags [P.], seq 1917632:1917836, ack 1189, win 319, length 204
04:30:35.858596 IP toroon0247w-lp130-11-184-148-73-232.dsl.bell.ca.50501 > lamp-s-1vcpu-1gb-tor1-01.ssh: Flags [.], ack 1914428, win 1022, length 0
04:30:35.858670 IP lamp-s-1vcpu-1gb-tor1-01.ssh > toroon0247w-lp130-11-184-148-73-232.dsl.bell.ca.50501: Flags [P.], seq 1917836:1918040, ack 1189, win 319, length 204
04:30:35.858758 IP lamp-s-1vcpu-1gb-tor1-01.ssh > toroon0247w-lp130-11-184-148-73-232.dsl.bell.ca.50501: Flags [P.], seq 1918040:1918396, ack 1189, win 319, length 356
04:30:35.858890 IP lamp-s-1vcpu-1gb-tor1-01.ssh > toroon0247w-lp130-11-184-148-73-232.dsl.bell.ca.50501: Flags [P.], seq 1918396:1918600, ack 1189, win 319, length 204
04:30:35.858988 IP lamp-s-1vcpu-1gb-tor1-01.ssh > toroon0247w-lp130-11-184-148-73-232.dsl.bell.ca.50501: Flags [P.], seq 1918600:1918804, ack 1189, win 319, length 204
04:30:35.859046 IP toroon0247w-lp130-11-184-148-73-232.dsl.bell.ca.50501 > lamp-s-1vcpu-1gb-tor1-01.ssh: Flags [.], ack 1915140, win 1026, length 0
04:30:35.859121 IP lamp-s-1vcpu-1gb-tor1-01.ssh > toroon0247w-lp130-11-184-148-73-232.dsl.bell.ca.50501: Flags [P.], seq 1918804:1919008, ack 1189, win 319, length 204
04:30:35.859244 IP lamp-s-1vcpu-1gb-tor1-01.ssh > toroon0247w-lp130-11-184-148-73-232.dsl.bell.ca.50501: Flags [P.], seq 1919008:1919364, ack 1189, win 319, length 356
04:30:35.859306 IP toroon0247w-lp130-11-184-148-73-232.dsl.bell.ca.50501 > lamp-s-1vcpu-1gb-tor1-01.ssh: Flags [.], ack 1916004, win 1023, length 0
04:30:35.859381 IP lamp-s-1vcpu-1gb-tor1-01.ssh > toroon0247w-lp130-11-184-148-73-232.dsl.bell.ca.50501: Flags [P.], seq 1919364:1919568, ack 1189, win 319, length 204
04:30:35.859467 IP lamp-s-1vcpu-1gb-tor1-01.ssh > toroon0247w-lp130-11-184-148-73-232.dsl.bell.ca.50501: Flags [P.], seq 1919568:1919924, ack 1189, win 319, length 356
04:30:35.859584 IP lamp-s-1vcpu-1gb-tor1-01.ssh > toroon0247w-lp130-11-184-148-73-232.dsl.bell.ca.50501: Flags [P.], seq 1919924:1920128, ack 1189, win 319, length 204
04:30:35.859658 IP toroon0247w-lp130-11-184-148-73-232.dsl.bell.ca.50501 > lamp-s-1vcpu-1gb-tor1-01.ssh: Flags [.], ack 1916868, win 1026, length 0
04:30:35.859753 IP lamp-s-1vcpu-1gb-tor1-01.ssh > toroon0247w-lp130-11-184-148-73-232.dsl.bell.ca.50501: Flags [P.], seq 1920128:1920332, ack 1189, win 319, length 204
04:30:35.859805 IP toroon0247w-lp130-11-184-148-73-232.dsl.bell.ca.50501 > lamp-s-1vcpu-1gb-tor1-01.ssh: Flags [.], ack 1917632, win 1023, length 0
04:30:35.859952 IP lamp-s-1vcpu-1gb-tor1-01.ssh > toroon0247w-lp130-11-184-148-73-232.dsl.bell.ca.50501: Flags [P.], seq 1920332:1920688, ack 1189, win 319, length 356
04:30:35.860053 IP lamp-s-1vcpu-1gb-tor1-01.ssh > toroon0247w-lp130-11-184-148-73-232.dsl.bell.ca.50501: Flags [P.], seq 1920688:1921044, ack 1189, win 319, length 356
04:30:35.860130 IP lamp-s-1vcpu-1gb-tor1-01.ssh > toroon0247w-lp130-11-184-148-73-232.dsl.bell.ca.50501: Flags [P.], seq 1921044:1921248, ack 1189, win 319, length 204
04:30:35.860172 IP toroon0247w-lp130-11-184-148-73-232.dsl.bell.ca.50501 > lamp-s-1vcpu-1gb-tor1-01.ssh: Flags [.], ack 1917836, win 1022, length 0
04:30:35.860298 IP lamp-s-1vcpu-1gb-tor1-01.ssh > toroon0247w-lp130-11-184-148-73-232.dsl.bell.ca.50501: Flags [P.], seq 1921248:1921452, ack 1189, win 319, length 204
04:30:35.860344 IP lamp-s-1vcpu-1gb-tor1-01.ssh > toroon0247w-lp130-11-184-148-73-232.dsl.bell.ca.50501: Flags [P.], seq 1921452:1921808, ack 1189, win 319, length 356
04:30:35.860419 IP toroon0247w-lp130-11-184-148-73-232.dsl.bell.ca.50501 > lamp-s-1vcpu-1gb-tor1-01.ssh: Flags [.], ack 1918396, win 1026, length 0
04:30:35.860500 IP lamp-s-1vcpu-1gb-tor1-01.ssh > toroon0247w-lp130-11-184-148-73-232.dsl.bell.ca.50501: Flags [P.], seq 1921808:1922332, ack 1189, win 319, length 524
04:30:35.860626 IP lamp-s-1vcpu-1gb-tor1-01.ssh > toroon0247w-lp130-11-184-148-73-232.dsl.bell.ca.50501: Flags [P.], seq 1922332:1922536, ack 1189, win 319, length 204
04:30:35.860682 IP toroon0247w-lp130-11-184-148-73-232.dsl.bell.ca.50501 > lamp-s-1vcpu-1gb-tor1-01.ssh: Flags [.], ack 1918804, win 1025, length 0
04:30:35.860697 IP toroon0247w-lp130-11-184-148-73-232.dsl.bell.ca.50501 > lamp-s-1vcpu-1gb-tor1-01.ssh: Flags [.], ack 1919364, win 1022, length 0
04:30:35.860788 IP toroon0247w-lp130-11-184-148-73-232.dsl.bell.ca.50501 > lamp-s-1vcpu-1gb-tor1-01.ssh: Flags [.], ack 1919924, win 1026, length 0
04:30:35.860824 IP lamp-s-1vcpu-1gb-tor1-01.ssh > toroon0247w-lp130-11-184-148-73-232.dsl.bell.ca.50501: Flags [P.], seq 1922536:1923044, ack 1189, win 319, length 508
04:30:35.860972 IP lamp-s-1vcpu-1gb-tor1-01.ssh > toroon0247w-lp130-11-184-148-73-232.dsl.bell.ca.50501: Flags [P.], seq 1923044:1923400, ack 1189, win 319, length 356
04:30:35.861072 IP lamp-s-1vcpu-1gb-tor1-01.ssh > toroon0247w-lp130-11-184-148-73-232.dsl.bell.ca.50501: Flags [P.], seq 1923400:1923604, ack 1189, win 319, length 204
04:30:35.861153 IP lamp-s-1vcpu-1gb-tor1-01.ssh > toroon0247w-lp130-11-184-148-73-232.dsl.bell.ca.50501: Flags [P.], seq 1923604:1923808, ack 1189, win 319, length 204
04:30:35.861252 IP lamp-s-1vcpu-1gb-tor1-01.ssh > toroon0247w-lp130-11-184-148-73-232.dsl.bell.ca.50501: Flags [P.], seq 1923808:1924012, ack 1189, win 319, length 204
04:30:35.861297 IP toroon0247w-lp130-11-184-148-73-232.dsl.bell.ca.50501 > lamp-s-1vcpu-1gb-tor1-01.ssh: Flags [.], ack 1920332, win 1025, length 0
04:30:35.861447 IP lamp-s-1vcpu-1gb-tor1-01.ssh > toroon0247w-lp130-11-184-148-73-232.dsl.bell.ca.50501: Flags [P.], seq 1924012:1924368, ack 1189, win 319, length 356
04:30:35.861589 IP lamp-s-1vcpu-1gb-tor1-01.ssh > toroon0247w-lp130-11-184-148-73-232.dsl.bell.ca.50501: Flags [P.], seq 1924368:1924572, ack 1189, win 319, length 204
04:30:35.861724 IP lamp-s-1vcpu-1gb-tor1-01.ssh > toroon0247w-lp130-11-184-148-73-232.dsl.bell.ca.50501: Flags [P.], seq 1924572:1924776, ack 1189, win 319, length 204
04:30:35.861805 IP toroon0247w-lp130-11-184-148-73-232.dsl.bell.ca.50501 > lamp-s-1vcpu-1gb-tor1-01.ssh: Flags [.], ack 1921808, win 1026, length 0
04:30:35.861926 IP lamp-s-1vcpu-1gb-tor1-01.ssh > toroon0247w-lp130-11-184-148-73-232.dsl.bell.ca.50501: Flags [P.], seq 1924776:1925132, ack 1189, win 319, length 356
04:30:35.862027 IP lamp-s-1vcpu-1gb-tor1-01.ssh > toroon0247w-lp130-11-184-148-73-232.dsl.bell.ca.50501: Flags [P.], seq 1925132:1925336, ack 1189, win 319, length 204
04:30:35.862044 IP toroon0247w-lp130-11-184-148-73-232.dsl.bell.ca.50501 > lamp-s-1vcpu-1gb-tor1-01.ssh: Flags [P.], seq 1189:1225, ack 1921808, win 1026, length 36
^C
10271 packets captured
10308 packets received by filter
37 packets dropped by kernel