04:29:51.876358 IP 159.203.56.71.22 > 184.148.73.232.50501: Flags [P.], seq 1299196:1299464, ack 757, win 319, length 268
04:29:51.876439 IP 159.203.56.71.22 > 184.148.73.232.50501: Flags [P.], seq 1299464:1299628, ack 757, win 319, length 164
04:29:51.876521 IP 184.148.73.232.50501 > 159.203.56.71.22: Flags [.], ack 1296664, win 1025, length 0
04:29:51.876531 IP 159.203.56.71.22 > 184.148.73.232.50501: Flags [P.], seq 1299628:1299792, ack 757, win 319, length 164
04:29:51.876625 IP 159.203.56.71.22 > 184.148.73.232.50501: Flags [P.], seq 1299792:1300060, ack 757, win 319, length 268
04:29:51.876703 IP 159.203.56.71.22 > 184.148.73.232.50501: Flags [P.], seq 1300060:1300224, ack 757, win 319, length 164
04:29:51.876817 IP 159.203.56.71.22 > 184.148.73.232.50501: Flags [P.], seq 1300224:1300388, ack 757, win 319, length 164
04:29:51.876902 IP 159.203.56.71.22 > 184.148.73.232.50501: Flags [P.], seq 1300388:1300552, ack 757, win 319, length 164
04:29:51.876977 IP 159.203.56.71.22 > 184.148.73.232.50501: Flags [P.], seq 1300552:1300716, ack 757, win 319, length 164
04:29:51.877046 IP 184.148.73.232.50501 > 159.203.56.71.22: Flags [.], ack 1297260, win 1023, length 0
04:29:51.877117 IP 159.203.56.71.22 > 184.148.73.232.50501: Flags [P.], seq 1300716:1300984, ack 757, win 319, length 268
04:29:51.877195 IP 159.203.56.71.22 > 184.148.73.232.50501: Flags [P.], seq 1300984:1301148, ack 757, win 319, length 164
04:29:51.877268 IP 159.203.56.71.22 > 184.148.73.232.50501: Flags [P.], seq 1301148:1301312, ack 757, win 319, length 164
04:29:51.877298 IP 184.148.73.232.50501 > 159.203.56.71.22: Flags [.], ack 1297632, win 1021, length 0
04:29:51.877384 IP 159.203.56.71.22 > 184.148.73.232.50501: Flags [P.], seq 1301312:1301580, ack 757, win 319, length 268
04:29:51.877466 IP 159.203.56.71.22 > 184.148.73.232.50501: Flags [P.], seq 1301580:1301744, ack 757, win 319, length 164
04:29:51.877527 IP 184.148.73.232.50501 > 159.203.56.71.22: Flags [.], ack 1298168, win 1026, length 0
04:29:51.877598 IP 159.203.56.71.22 > 184.148.73.232.50501: Flags [P.], seq 1301744:1302012, ack 757, win 319, length 268
04:29:51.877638 IP 184.148.73.232.50501 > 159.203.56.71.22: Flags [.], ack 1298764, win 1024, length 0
04:29:51.877719 IP 159.203.56.71.22 > 184.148.73.232.50501: Flags [P.], seq 1302012:1302280, ack 757, win 319, length 268
04:29:51.877791 IP 184.148.73.232.50501 > 159.203.56.71.22: Flags [.], ack 1298928, win 1023, length 0
04:29:51.877828 IP 159.203.56.71.22 > 184.148.73.232.50501: Flags [P.], seq 1302280:1302444, ack 757, win 319, length 164
04:29:51.877893 IP 184.148.73.232.50501 > 159.203.56.71.22: Flags [.], ack 1299464, win 1021, length 0
04:29:51.877966 IP 159.203.56.71.22 > 184.148.73.232.50501: Flags [P.], seq 1302444:1302816, ack 757, win 319, length 372
04:29:51.878046 IP 159.203.56.71.22 > 184.148.73.232.50501: Flags [P.], seq 1302816:1302980, ack 757, win 319, length 164
04:29:51.878119 IP 159.203.56.71.22 > 184.148.73.232.50501: Flags [P.], seq 1302980:1303144, ack 757, win 319, length 164
04:29:51.878191 IP 159.203.56.71.22 > 184.148.73.232.50501: Flags [P.], seq 1303144:1303308, ack 757, win 319, length 164
04:29:51.878283 IP 184.148.73.232.50501 > 159.203.56.71.22: Flags [P.], seq 757:793, ack 1299628, win 1026, length 36
04:29:51.878360 IP 159.203.56.71.22 > 184.148.73.232.50501: Flags [P.], seq 1303308:1303584, ack 793, win 319, length 276
04:29:51.878414 IP 184.148.73.232.50501 > 159.203.56.71.22: Flags [.], ack 1300060, win 1024, length 0
^C
9279 packets captured
9311 packets received by filter
31 packets dropped by kernel