04:31:03.392315 IP lamp-s-1vcpu-1gb-tor1-01.ssh > toroon0247w-lp130-11-184-148-73-232.dsl.bell.ca.50501: Flags [P.], seq 1541664:1541868, ack 973, win 319, length 204
04:31:03.392497 IP lamp-s-1vcpu-1gb-tor1-01.ssh > toroon0247w-lp130-11-184-148-73-232.dsl.bell.ca.50501: Flags [P.], seq 1541868:1542072, ack 973, win 319, length 204
04:31:03.392661 IP lamp-s-1vcpu-1gb-tor1-01.ssh > toroon0247w-lp130-11-184-148-73-232.dsl.bell.ca.50501: Flags [P.], seq 1542072:1542276, ack 973, win 319, length 204
04:31:03.392806 IP lamp-s-1vcpu-1gb-tor1-01.ssh > toroon0247w-lp130-11-184-148-73-232.dsl.bell.ca.50501: Flags [P.], seq 1542276:1542480, ack 973, win 319, length 204
04:31:03.392932 IP toroon0247w-lp130-11-184-148-73-232.dsl.bell.ca.50501 > lamp-s-1vcpu-1gb-tor1-01.ssh: Flags [.], ack 1540848, win 1026, length 0
04:31:03.393108 IP lamp-s-1vcpu-1gb-tor1-01.ssh > toroon0247w-lp130-11-184-148-73-232.dsl.bell.ca.50501: Flags [P.], seq 1542480:1542836, ack 973, win 319, length 356
04:31:03.393173 IP toroon0247w-lp130-11-184-148-73-232.dsl.bell.ca.50501 > lamp-s-1vcpu-1gb-tor1-01.ssh: Flags [.], ack 1541256, win 1025, length 0
04:31:03.393361 IP lamp-s-1vcpu-1gb-tor1-01.ssh > toroon0247w-lp130-11-184-148-73-232.dsl.bell.ca.50501: Flags [P.], seq 1542836:1543192, ack 973, win 319, length 356
04:31:03.393425 IP toroon0247w-lp130-11-184-148-73-232.dsl.bell.ca.50501 > lamp-s-1vcpu-1gb-tor1-01.ssh: Flags [.], ack 1541664, win 1023, length 0
04:31:03.393610 IP lamp-s-1vcpu-1gb-tor1-01.ssh > toroon0247w-lp130-11-184-148-73-232.dsl.bell.ca.50501: Flags [P.], seq 1543192:1543548, ack 973, win 319, length 356
04:31:03.393812 IP lamp-s-1vcpu-1gb-tor1-01.ssh > toroon0247w-lp130-11-184-148-73-232.dsl.bell.ca.50501: Flags [P.], seq 1543548:1543752, ack 973, win 319, length 204
04:31:03.393938 IP toroon0247w-lp130-11-184-148-73-232.dsl.bell.ca.50501 > lamp-s-1vcpu-1gb-tor1-01.ssh: Flags [.], ack 1542072, win 1021, length 0
04:31:03.394031 IP lamp-s-1vcpu-1gb-tor1-01.ssh > toroon0247w-lp130-11-184-148-73-232.dsl.bell.ca.50501: Flags [P.], seq 1543752:1543956, ack 973, win 319, length 204
04:31:03.394081 IP lamp-s-1vcpu-1gb-tor1-01.ssh > toroon0247w-lp130-11-184-148-73-232.dsl.bell.ca.50501: Flags [P.], seq 1543956:1544144, ack 973, win 319, length 188
04:31:03.394426 IP toroon0247w-lp130-11-184-148-73-232.dsl.bell.ca.50501 > lamp-s-1vcpu-1gb-tor1-01.ssh: Flags [.], ack 1542480, win 1026, length 0
04:31:03.394936 IP toroon0247w-lp130-11-184-148-73-232.dsl.bell.ca.50501 > lamp-s-1vcpu-1gb-tor1-01.ssh: Flags [.], ack 1543192, win 1023, length 0
04:31:03.395195 IP toroon0247w-lp130-11-184-148-73-232.dsl.bell.ca.50501 > lamp-s-1vcpu-1gb-tor1-01.ssh: Flags [.], ack 1543752, win 1021, length 0
04:31:03.395444 IP toroon0247w-lp130-11-184-148-73-232.dsl.bell.ca.50501 > lamp-s-1vcpu-1gb-tor1-01.ssh: Flags [.], ack 1544144, win 1026, length 0
04:31:03.396893 IP lamp-s-1vcpu-1gb-tor1-01.ssh > 222.186.175.220.56348: Flags [P.], seq 1:42, ack 1, win 227, options [nop,nop,TS val 1494012656 ecr 3054532304], length 41
04:31:03.397144 IP lamp-s-1vcpu-1gb-tor1-01.ssh > toroon0247w-lp130-11-184-148-73-232.dsl.bell.ca.50501: Flags [P.], seq 1544144:1544516, ack 973, win 319, length 372
04:31:03.397335 IP lamp-s-1vcpu-1gb-tor1-01.ssh > toroon0247w-lp130-11-184-148-73-232.dsl.bell.ca.50501: Flags [P.], seq 1544516:1545488, ack 973, win 319, length 972
04:31:03.397461 IP lamp-s-1vcpu-1gb-tor1-01.ssh > toroon0247w-lp130-11-184-148-73-232.dsl.bell.ca.50501: Flags [P.], seq 1545488:1545692, ack 973, win 319, length 204
04:31:03.397654 IP lamp-s-1vcpu-1gb-tor1-01.ssh > toroon0247w-lp130-11-184-148-73-232.dsl.bell.ca.50501: Flags [P.], seq 1545692:1545896, ack 973, win 319, length 204
04:31:03.397875 IP lamp-s-1vcpu-1gb-tor1-01.ssh > toroon0247w-lp130-11-184-148-73-232.dsl.bell.ca.50501: Flags [P.], seq 1545896:1546100, ack 973, win 319, length 204
04:31:03.398034 IP lamp-s-1vcpu-1gb-tor1-01.ssh > toroon0247w-lp130-11-184-148-73-232.dsl.bell.ca.50501: Flags [P.], seq 1546100:1546304, ack 973, win 319, length 204
04:31:03.398182 IP lamp-s-1vcpu-1gb-tor1-01.ssh > toroon0247w-lp130-11-184-148-73-232.dsl.bell.ca.50501: Flags [P.], seq 1546304:1546508, ack 973, win 319, length 204
04:31:03.398346 IP lamp-s-1vcpu-1gb-tor1-01.ssh > toroon0247w-lp130-11-184-148-73-232.dsl.bell.ca.50501: Flags [P.], seq 1546508:1546712, ack 973, win 319, length 204
04:31:03.398456 IP lamp-s-1vcpu-1gb-tor1-01.ssh > toroon0247w-lp130-11-184-148-73-232.dsl.bell.ca.50501: Flags [P.], seq 1546712:1546916, ack 973, win 319, length 204
04:31:03.398562 IP lamp-s-1vcpu-1gb-tor1-01.ssh > toroon0247w-lp130-11-184-148-73-232.dsl.bell.ca.50501: Flags [P.], seq 1546916:1547120, ack 973, win 319, length 204
04:31:03.398721 IP lamp-s-1vcpu-1gb-tor1-01.ssh > toroon0247w-lp130-11-184-148-73-232.dsl.bell.ca.50501: Flags [P.], seq 1547120:1547324, ack 973, win 319, length 204
04:31:03.398817 IP toroon0247w-lp130-11-184-148-73-232.dsl.bell.ca.50501 > lamp-s-1vcpu-1gb-tor1-01.ssh: Flags [.], ack 1545488, win 1021, length 0
04:31:03.398986 IP lamp-s-1vcpu-1gb-tor1-01.ssh > toroon0247w-lp130-11-184-148-73-232.dsl.bell.ca.50501: Flags [P.], seq 1547324:1547680, ack 973, win 319, length 356
04:31:03.399083 IP toroon0247w-lp130-11-184-148-73-232.dsl.bell.ca.50501 > lamp-s-1vcpu-1gb-tor1-01.ssh: Flags [.], ack 1545896, win 1026, length 0
04:31:03.399221 IP lamp-s-1vcpu-1gb-tor1-01.ssh > toroon0247w-lp130-11-184-148-73-232.dsl.bell.ca.50501: Flags [P.], seq 1547680:1548036, ack 973, win 319, length 356
04:31:03.399357 IP lamp-s-1vcpu-1gb-tor1-01.ssh > toroon0247w-lp130-11-184-148-73-232.dsl.bell.ca.50501: Flags [P.], seq 1548036:1548240, ack 973, win 319, length 204
04:31:03.399430 IP toroon0247w-lp130-11-184-148-73-232.dsl.bell.ca.50501 > lamp-s-1vcpu-1gb-tor1-01.ssh: Flags [.], ack 1546304, win 1025, length 0
04:31:03.399539 IP lamp-s-1vcpu-1gb-tor1-01.ssh > toroon0247w-lp130-11-184-148-73-232.dsl.bell.ca.50501: Flags [P.], seq 1548240:1548596, ack 973, win 319, length 356
04:31:03.399654 IP lamp-s-1vcpu-1gb-tor1-01.ssh > toroon0247w-lp130-11-184-148-73-232.dsl.bell.ca.50501: Flags [P.], seq 1548596:1548800, ack 973, win 319, length 204
04:31:03.399770 IP lamp-s-1vcpu-1gb-tor1-01.ssh > toroon0247w-lp130-11-184-148-73-232.dsl.bell.ca.50501: Flags [P.], seq 1548800:1549004, ack 973, win 319, length 204
04:31:03.399913 IP lamp-s-1vcpu-1gb-tor1-01.ssh > toroon0247w-lp130-11-184-148-73-232.dsl.bell.ca.50501: Flags [P.], seq 1549004:1549208, ack 973, win 319, length 204
04:31:03.399955 IP toroon0247w-lp130-11-184-148-73-232.dsl.bell.ca.50501 > lamp-s-1vcpu-1gb-tor1-01.ssh: Flags [.], ack 1546712, win 1023, length 0
04:31:03.400118 IP lamp-s-1vcpu-1gb-tor1-01.ssh > toroon0247w-lp130-11-184-148-73-232.dsl.bell.ca.50501: Flags [P.], seq 1549208:1549564, ack 973, win 319, length 356
04:31:03.400190 IP toroon0247w-lp130-11-184-148-73-232.dsl.bell.ca.50501 > lamp-s-1vcpu-1gb-tor1-01.ssh: Flags [.], ack 1547120, win 1021, length 0
04:31:03.400321 IP lamp-s-1vcpu-1gb-tor1-01.ssh > toroon0247w-lp130-11-184-148-73-232.dsl.bell.ca.50501: Flags [P.], seq 1549564:1549920, ack 973, win 319, length 356
04:31:03.400515 IP lamp-s-1vcpu-1gb-tor1-01.ssh > toroon0247w-lp130-11-184-148-73-232.dsl.bell.ca.50501: Flags [P.], seq 1549920:1550124, ack 973, win 319, length 204
04:31:03.400719 IP lamp-s-1vcpu-1gb-tor1-01.ssh > toroon0247w-lp130-11-184-148-73-232.dsl.bell.ca.50501: Flags [P.], seq 1550124:1550328, ack 973, win 319, length 204
04:31:03.400915 IP lamp-s-1vcpu-1gb-tor1-01.ssh > toroon0247w-lp130-11-184-148-73-232.dsl.bell.ca.50501: Flags [P.], seq 1550328:1550532, ack 973, win 319, length 204
04:31:03.400967 IP toroon0247w-lp130-11-184-148-73-232.dsl.bell.ca.50501 > lamp-s-1vcpu-1gb-tor1-01.ssh: Flags [.], ack 1548036, win 1026, length 0
04:31:03.400982 IP toroon0247w-lp130-11-184-148-73-232.dsl.bell.ca.50501 > lamp-s-1vcpu-1gb-tor1-01.ssh: Flags [.], ack 1548240, win 1025, length 0
04:31:03.401058 IP toroon0247w-lp130-11-184-148-73-232.dsl.bell.ca.50501 > lamp-s-1vcpu-1gb-tor1-01.ssh: Flags [.], ack 1548800, win 1023, length 0
04:31:03.401330 IP lamp-s-1vcpu-1gb-tor1-01.ssh > toroon0247w-lp130-11-184-148-73-232.dsl.bell.ca.50501: Flags [P.], seq 1550532:1551184, ack 973, win 319, length 652
04:31:03.401438 IP toroon0247w-lp130-11-184-148-73-232.dsl.bell.ca.50501 > lamp-s-1vcpu-1gb-tor1-01.ssh: Flags [.], ack 1549208, win 1022, length 0
04:31:03.401631 IP lamp-s-1vcpu-1gb-tor1-01.ssh > toroon0247w-lp130-11-184-148-73-232.dsl.bell.ca.50501: Flags [P.], seq 1551184:1551540, ack 973, win 319, length 356
04:31:03.401831 IP toroon0247w-lp130-11-184-148-73-232.dsl.bell.ca.50501 > lamp-s-1vcpu-1gb-tor1-01.ssh: Flags [.], ack 1549920, win 1026, length 0
04:31:03.401879 IP lamp-s-1vcpu-1gb-tor1-01.ssh > toroon0247w-lp130-11-184-148-73-232.dsl.bell.ca.50501: Flags [P.], seq 1551540:1551744, ack 973, win 319, length 204
04:31:03.402106 IP lamp-s-1vcpu-1gb-tor1-01.ssh > toroon0247w-lp130-11-184-148-73-232.dsl.bell.ca.50501: Flags [P.], seq 1551744:1552100, ack 973, win 319, length 356
04:31:03.402308 IP toroon0247w-lp130-11-184-148-73-232.dsl.bell.ca.50501 > lamp-s-1vcpu-1gb-tor1-01.ssh: Flags [.], ack 1550328, win 1025, length 0
04:31:03.402370 IP lamp-s-1vcpu-1gb-tor1-01.ssh > toroon0247w-lp130-11-184-148-73-232.dsl.bell.ca.50501: Flags [P.], seq 1552100:1552304, ack 973, win 319, length 204
04:31:03.402549 IP lamp-s-1vcpu-1gb-tor1-01.ssh > toroon0247w-lp130-11-184-148-73-232.dsl.bell.ca.50501: Flags [P.], seq 1552304:1552660, ack 973, win 319, length 356
04:31:03.402736 IP lamp-s-1vcpu-1gb-tor1-01.ssh > toroon0247w-lp130-11-184-148-73-232.dsl.bell.ca.50501: Flags [P.], seq 1552660:1552864, ack 973, win 319, length 204
04:31:03.402885 IP lamp-s-1vcpu-1gb-tor1-01.ssh > toroon0247w-lp130-11-184-148-73-232.dsl.bell.ca.50501: Flags [P.], seq 1552864:1553068, ack 973, win 319, length 204
04:31:03.402998 IP lamp-s-1vcpu-1gb-tor1-01.ssh > toroon0247w-lp130-11-184-148-73-232.dsl.bell.ca.50501: Flags [P.], seq 1553068:1553272, ack 973, win 319, length 204
04:31:03.403103 IP lamp-s-1vcpu-1gb-tor1-01.ssh > toroon0247w-lp130-11-184-148-73-232.dsl.bell.ca.50501: Flags [P.], seq 1553272:1553476, ack 973, win 319, length 204
04:31:03.403185 IP toroon0247w-lp130-11-184-148-73-232.dsl.bell.ca.50501 > lamp-s-1vcpu-1gb-tor1-01.ssh: Flags [.], ack 1551540, win 1026, length 0
04:31:03.403314 IP toroon0247w-lp130-11-184-148-73-232.dsl.bell.ca.50501 > lamp-s-1vcpu-1gb-tor1-01.ssh: Flags [P.], seq 973:1009, ack 1551540, win 1026, length 36
04:31:03.403428 IP lamp-s-1vcpu-1gb-tor1-01.ssh > toroon0247w-lp130-11-184-148-73-232.dsl.bell.ca.50501: Flags [P.], seq 1553476:1553832, ack 973, win 319, length 356
04:31:03.403587 IP toroon0247w-lp130-11-184-148-73-232.dsl.bell.ca.50501 > lamp-s-1vcpu-1gb-tor1-01.ssh: Flags [.], ack 1552100, win 1024, length 0
^C
8217 packets captured
8251 packets received by filter
34 packets dropped by kernel