root@lamp-s-1vcpu-1gb-tor1-01:~# tcpdump -r 0001.pcap
reading from file 0001.pcap, link-type EN10MB (Ethernet)
04:25:44.718073 IP lamp-s-1vcpu-1gb-tor1-01.ssh > toroon0247w-lp130-11-184-148-73-232.dsl.bell.ca.50361: Flags [P.], seq 284473444:284473488, ack 845795187, win 319, length 44
04:25:44.718226 IP lamp-s-1vcpu-1gb-tor1-01.ssh > toroon0247w-lp130-11-184-148-73-232.dsl.bell.ca.50361: Flags [P.], seq 44:152, ack 1, win 319, length 108
04:25:44.718338 IP lamp-s-1vcpu-1gb-tor1-01.ssh > toroon0247w-lp130-11-184-148-73-232.dsl.bell.ca.50361: Flags [P.], seq 152:188, ack 1, win 319, length 36
04:25:44.719665 IP toroon0247w-lp130-11-184-148-73-232.dsl.bell.ca.50361 > lamp-s-1vcpu-1gb-tor1-01.ssh: Flags [.], ack 44, win 1025, length 0
04:25:44.719872 IP toroon0247w-lp130-11-184-148-73-232.dsl.bell.ca.50361 > lamp-s-1vcpu-1gb-tor1-01.ssh: Flags [.], ack 188, win 1024, length 0
04:25:46.360364 IP 123.143.3.44.57176 > lamp-s-1vcpu-1gb-tor1-01.ssh: Flags [S], seq 705795264, win 64240, options [mss 1460,sackOK,TS val 4020240498 ecr 0,nop,wscale 7], length 0
04:25:46.360427 IP lamp-s-1vcpu-1gb-tor1-01 > 123.143.3.44: ICMP lamp-s-1vcpu-1gb-tor1-01 tcp port ssh unreachable, length 68
04:25:55.722352 IP lamp-s-1vcpu-1gb-tor1-01.ssh > 167.99.75.206.50342: Flags [P.], seq 2080719460:2080719528, ack 83522765, win 235, options [nop,nop,TS val 3031250490 ecr 3387706728], length 68
04:25:55.980014 IP 167.99.75.206.50342 > lamp-s-1vcpu-1gb-tor1-01.ssh: Flags [.], ack 68, win 154, options [nop,nop,TS val 3387750358 ecr 3031250490,nop,nop,sack 1 {0:68}], length 0
04:25:55.980080 IP lamp-s-1vcpu-1gb-tor1-01 > 167.99.75.206: ICMP lamp-s-1vcpu-1gb-tor1-01 tcp port ssh unreachable, length 72
04:25:59.778597 IP ip-address-pool-xxx.fpt.vn.32041 > lamp-s-1vcpu-1gb-tor1-01.microsoft-ds: Flags [S], seq 3282461034, win 8192, options [mss 1412,nop,nop,sackOK], length 0
04:26:01.004504 IP 218.92.0.211.53034 > lamp-s-1vcpu-1gb-tor1-01.ssh: Flags [S], seq 976446902, win 29200, options [mss 1460,sackOK,TS val 605035287 ecr 0,nop,wscale 7], length 0
04:26:01.004699 IP lamp-s-1vcpu-1gb-tor1-01.ssh > 218.92.0.211.53034: Flags [S.], seq 238014089, ack 976446903, win 28960, options [mss 1460,sackOK,TS val 901219046 ecr 605035287,nop,wscale 7], length 0
04:26:02.006810 IP 218.92.0.211.53034 > lamp-s-1vcpu-1gb-tor1-01.ssh: Flags [S], seq 976446902, win 29200, options [mss 1460,sackOK,TS val 605035538 ecr 0,nop,wscale 7], length 0
04:26:02.006900 IP lamp-s-1vcpu-1gb-tor1-01.ssh > 218.92.0.211.53034: Flags [S.], seq 238014089, ack 976446903, win 28960, options [mss 1460,sackOK,TS val 901220048 ecr 605035287,nop,wscale 7], length 0
04:26:02.243038 IP 218.92.0.211.53034 > lamp-s-1vcpu-1gb-tor1-01.ssh: Flags [.], ack 1, win 229, options [nop,nop,TS val 605035597 ecr 901220048], length 0
04:26:02.243138 IP 218.92.0.211.53034 > lamp-s-1vcpu-1gb-tor1-01.ssh: Flags [P.], seq 1:16, ack 1, win 229, options [nop,nop,TS val 605035597 ecr 901220048], length 15
04:26:02.255739 IP lamp-s-1vcpu-1gb-tor1-01.ssh > 218.92.0.211.53034: Flags [P.], seq 1:42, ack 1, win 227, options [nop,nop,TS val 901220297 ecr 605035597], length 41
04:26:02.497763 IP 218.92.0.211.53034 > lamp-s-1vcpu-1gb-tor1-01.ssh: Flags [.], ack 42, win 229, options [nop,nop,TS val 605035660 ecr 901220297], length 0
04:26:04.986797 IP 218.92.0.211.53034 > lamp-s-1vcpu-1gb-tor1-01.ssh: Flags [P.], seq 16:872, ack 42, win 229, options [nop,nop,TS val 605036282 ecr 901220297], length 856
04:26:05.692785 IP 167.99.75.206.50342 > lamp-s-1vcpu-1gb-tor1-01.ssh: Flags [P.], seq 1:53, ack 68, win 154, options [nop,nop,TS val 3387760072 ecr 3031250490], length 52
04:26:05.692856 IP lamp-s-1vcpu-1gb-tor1-01 > 167.99.75.206: ICMP lamp-s-1vcpu-1gb-tor1-01 tcp port ssh unreachable, length 112
04:26:07.501641 IP 218.92.0.211.53034 > lamp-s-1vcpu-1gb-tor1-01.ssh: Flags [FP.], seq 872:896, ack 42, win 229, options [nop,nop,TS val 605036911 ecr 901220297], length 24
04:26:07.692938 IP col77-1_migr-88-125-188-244.fbx.proxad.net.1228 > lamp-s-1vcpu-1gb-tor1-01.ssh: Flags [S], seq 3452402891, win 29200, options [mss 1460,sackOK,TS val 1536514160 ecr 0,nop,wscale 7], length 0
04:26:07.693033 IP lamp-s-1vcpu-1gb-tor1-01.ssh > col77-1_migr-88-125-188-244.fbx.proxad.net.1228: Flags [S.], seq 4112681234, ack 3452402892, win 28960, options [mss 1460,sackOK,TS val 4056592206 ecr 1536514160,nop,wscale 7], length 0
04:26:07.800727 IP col77-1_migr-88-125-188-244.fbx.proxad.net.1228 > lamp-s-1vcpu-1gb-tor1-01.ssh: Flags [.], ack 1, win 229, options [nop,nop,TS val 1536514270 ecr 4056592206], length 0
04:26:07.801883 IP col77-1_migr-88-125-188-244.fbx.proxad.net.1228 > lamp-s-1vcpu-1gb-tor1-01.ssh: Flags [P.], seq 1:23, ack 1, win 229, options [nop,nop,TS val 1536514270 ecr 4056592206], length 22
04:26:07.801934 IP lamp-s-1vcpu-1gb-tor1-01.ssh > col77-1_migr-88-125-188-244.fbx.proxad.net.1228: Flags [.], ack 23, win 227, options [nop,nop,TS val 4056592315 ecr 1536514270], length 0
04:26:07.815502 IP lamp-s-1vcpu-1gb-tor1-01.ssh > col77-1_migr-88-125-188-244.fbx.proxad.net.1228: Flags [P.], seq 1:42, ack 23, win 227, options [nop,nop,TS val 4056592329 ecr 1536514270], length 41
04:26:07.923677 IP col77-1_migr-88-125-188-244.fbx.proxad.net.1228 > lamp-s-1vcpu-1gb-tor1-01.ssh: Flags [.], ack 42, win 229, options [nop,nop,TS val 1536514392 ecr 4056592329], length 0
04:26:07.923759 IP lamp-s-1vcpu-1gb-tor1-01.ssh > col77-1_migr-88-125-188-244.fbx.proxad.net.1228: Flags [P.], seq 42:1122, ack 23, win 227, options [nop,nop,TS val 4056592437 ecr 1536514392], length 1080
04:26:08.033061 IP col77-1_migr-88-125-188-244.fbx.proxad.net.1228 > lamp-s-1vcpu-1gb-tor1-01.ssh: Flags [.], ack 1122, win 245, options [nop,nop,TS val 1536514502 ecr 4056592437], length 0
04:26:08.039693 IP col77-1_migr-88-125-188-244.fbx.proxad.net.1228 > lamp-s-1vcpu-1gb-tor1-01.ssh: Flags [P.], seq 23:599, ack 1122, win 245, options [nop,nop,TS val 1536514502 ecr 4056592437], length 576
04:26:08.082314 IP lamp-s-1vcpu-1gb-tor1-01.ssh > col77-1_migr-88-125-188-244.fbx.proxad.net.1228: Flags [.], ack 599, win 236, options [nop,nop,TS val 4056592596 ecr 1536514502], length 0
04:26:08.190232 IP col77-1_migr-88-125-188-244.fbx.proxad.net.1228 > lamp-s-1vcpu-1gb-tor1-01.ssh: Flags [P.], seq 599:647, ack 1122, win 245, options [nop,nop,TS val 1536514659 ecr 4056592596], length 48
04:26:08.190293 IP lamp-s-1vcpu-1gb-tor1-01.ssh > col77-1_migr-88-125-188-244.fbx.proxad.net.1228: Flags [.], ack 647, win 236, options [nop,nop,TS val 4056592704 ecr 1536514659], length 0
04:26:08.205325 IP lamp-s-1vcpu-1gb-tor1-01.ssh > col77-1_migr-88-125-188-244.fbx.proxad.net.1228: Flags [P.], seq 1122:1330, ack 647, win 236, options [nop,nop,TS val 4056592719 ecr 1536514659], length 208
04:26:08.354588 IP col77-1_migr-88-125-188-244.fbx.proxad.net.1228 > lamp-s-1vcpu-1gb-tor1-01.ssh: Flags [.], ack 1330, win 262, options [nop,nop,TS val 1536514824 ecr 4056592719], length 0
04:26:08.366372 IP col77-1_migr-88-125-188-244.fbx.proxad.net.1228 > lamp-s-1vcpu-1gb-tor1-01.ssh: Flags [P.], seq 647:663, ack 1330, win 262, options [nop,nop,TS val 1536514836 ecr 4056592719], length 16
04:26:08.410308 IP lamp-s-1vcpu-1gb-tor1-01.ssh > col77-1_migr-88-125-188-244.fbx.proxad.net.1228: Flags [.], ack 663, win 236, options [nop,nop,TS val 4056592924 ecr 1536514836], length 0
04:26:08.518432 IP col77-1_migr-88-125-188-244.fbx.proxad.net.1228 > lamp-s-1vcpu-1gb-tor1-01.ssh: Flags [P.], seq 663:727, ack 1330, win 262, options [nop,nop,TS val 1536514987 ecr 4056592924], length 64
04:26:08.518502 IP lamp-s-1vcpu-1gb-tor1-01.ssh > col77-1_migr-88-125-188-244.fbx.proxad.net.1228: Flags [.], ack 727, win 236, options [nop,nop,TS val 4056593032 ecr 1536514987], length 0
04:26:08.518686 IP lamp-s-1vcpu-1gb-tor1-01.ssh > col77-1_migr-88-125-188-244.fbx.proxad.net.1228: Flags [P.], seq 1330:1394, ack 727, win 236, options [nop,nop,TS val 4056593032 ecr 1536514987], length 64
04:26:08.630036 IP col77-1_migr-88-125-188-244.fbx.proxad.net.1228 > lamp-s-1vcpu-1gb-tor1-01.ssh: Flags [.], ack 1394, win 262, options [nop,nop,TS val 1536515095 ecr 4056593032], length 0
04:26:08.632219 IP col77-1_migr-88-125-188-244.fbx.proxad.net.1228 > lamp-s-1vcpu-1gb-tor1-01.ssh: Flags [P.], seq 727:823, ack 1394, win 262, options [nop,nop,TS val 1536515096 ecr 4056593032], length 96
04:26:08.674329 IP lamp-s-1vcpu-1gb-tor1-01.ssh > col77-1_migr-88-125-188-244.fbx.proxad.net.1228: Flags [.], ack 823, win 236, options [nop,nop,TS val 4056593188 ecr 1536515096], length 0
04:26:09.982676 IP 218.92.0.211.53034 > lamp-s-1vcpu-1gb-tor1-01.ssh: Flags [FP.], seq 872:896, ack 42, win 229, options [nop,nop,TS val 605037532 ecr 901220297], length 24
04:26:09.982730 IP lamp-s-1vcpu-1gb-tor1-01.ssh > 218.92.0.211.53034: Flags [.], ack 1, win 235, options [nop,nop,TS val 901228024 ecr 605035597,nop,nop,sack 1 {872:897}], length 0
04:26:10.026979 IP 218.232.135.95.50180 > lamp-s-1vcpu-1gb-tor1-01.ssh: Flags [S], seq 2596810008, win 29200, options [mss 1460,sackOK,TS val 104490701 ecr 0,nop,wscale 7], length 0
04:26:10.027055 IP lamp-s-1vcpu-1gb-tor1-01 > 218.232.135.95: ICMP lamp-s-1vcpu-1gb-tor1-01 tcp port ssh unreachable, length 68
04:26:10.530811 IP 218.92.0.211.53034 > lamp-s-1vcpu-1gb-tor1-01.ssh: Flags [P.], seq 1:872, ack 42, win 229, options [nop,nop,TS val 605037669 ecr 901228024], length 871
04:26:10.530897 IP lamp-s-1vcpu-1gb-tor1-01.ssh > 218.92.0.211.53034: Flags [.], ack 897, win 249, options [nop,nop,TS val 901228572 ecr 605037669], length 0
04:26:10.532683 IP lamp-s-1vcpu-1gb-tor1-01.ssh > 218.92.0.211.53034: Flags [P.], seq 42:1122, ack 897, win 249, options [nop,nop,TS val 901228574 ecr 605037669], length 1080
04:26:10.537654 IP lamp-s-1vcpu-1gb-tor1-01.ssh > 218.92.0.211.53034: Flags [F.], seq 1122, ack 897, win 249, options [nop,nop,TS val 901228579 ecr 605037669], length 0
04:26:10.772597 IP 218.92.0.211.53034 > lamp-s-1vcpu-1gb-tor1-01.ssh: Flags [R], seq 976447799, win 0, length 0
04:26:10.797109 IP lamp-s-1vcpu-1gb-tor1-01.ssh > col77-1_migr-88-125-188-244.fbx.proxad.net.1228: Flags [P.], seq 1394:1474, ack 823, win 236, options [nop,nop,TS val 4056595311 ecr 1536515096], length 80
04:26:10.904562 IP col77-1_migr-88-125-188-244.fbx.proxad.net.1228 > lamp-s-1vcpu-1gb-tor1-01.ssh: Flags [P.], seq 823:887, ack 1474, win 262, options [nop,nop,TS val 1536517374 ecr 4056595311], length 64
04:26:10.904674 IP lamp-s-1vcpu-1gb-tor1-01.ssh > col77-1_migr-88-125-188-244.fbx.proxad.net.1228: Flags [.], ack 887, win 236, options [nop,nop,TS val 4056595418 ecr 1536517374], length 0
04:26:10.905725 IP col77-1_migr-88-125-188-244.fbx.proxad.net.1228 > lamp-s-1vcpu-1gb-tor1-01.ssh: Flags [F.], seq 887, ack 1474, win 262, options [nop,nop,TS val 1536517374 ecr 4056595311], length 0
04:26:10.907749 IP lamp-s-1vcpu-1gb-tor1-01.ssh > col77-1_migr-88-125-188-244.fbx.proxad.net.1228: Flags [F.], seq 1474, ack 888, win 236, options [nop,nop,TS val 4056595421 ecr 1536517374], length 0
04:26:11.014866 IP col77-1_migr-88-125-188-244.fbx.proxad.net.1228 > lamp-s-1vcpu-1gb-tor1-01.ssh: Flags [.], ack 1475, win 262, options [nop,nop,TS val 1536517484 ecr 4056595421], length 0
04:26:11.096182 IP 112.121.163.11.51650 > lamp-s-1vcpu-1gb-tor1-01.22222: Flags [S], seq 1887440853, win 1024, length 0
04:26:12.087273 IP 185.156.73.66.44779 > lamp-s-1vcpu-1gb-tor1-01.2182: Flags [S], seq 1570172000, win 1024, length 0
04:26:14.154327 IP lamp-s-1vcpu-1gb-tor1-01.ssh > 121.137.106.165.42194: Flags [P.], seq 399983859:399983927, ack 1594708950, win 235, options [nop,nop,TS val 47488075 ecr 145608036], length 68
04:26:19.318635 IP ws44-cashlink-bn-ac1-p14.telnet.com.bd.56180 > lamp-s-1vcpu-1gb-tor1-01.ssh: Flags [S], seq 4074335646, win 29200, options [mss 1460,sackOK,TS val 3684880107 ecr 0,nop,wscale 7], length 0
04:26:19.318757 IP lamp-s-1vcpu-1gb-tor1-01.ssh > ws44-cashlink-bn-ac1-p14.telnet.com.bd.56180: Flags [S.], seq 990779536, ack 4074335647, win 28960, options [mss 1460,sackOK,TS val 2023236415 ecr 3684880107,nop,wscale 7], length 0
04:26:19.605261 IP ws44-cashlink-bn-ac1-p14.telnet.com.bd.56180 > lamp-s-1vcpu-1gb-tor1-01.ssh: Flags [.], ack 1, win 229, options [nop,nop,TS val 3684880396 ecr 2023236415], length 0
04:26:19.618358 IP lamp-s-1vcpu-1gb-tor1-01.ssh > ws44-cashlink-bn-ac1-p14.telnet.com.bd.56180: Flags [P.], seq 1:42, ack 1, win 227, options [nop,nop,TS val 2023236715 ecr 3684880396], length 41
04:26:19.911966 IP ws44-cashlink-bn-ac1-p14.telnet.com.bd.56180 > lamp-s-1vcpu-1gb-tor1-01.ssh: Flags [.], ack 42, win 229, options [nop,nop,TS val 3684880704 ecr 2023236715], length 0
04:26:19.924137 IP ws44-cashlink-bn-ac1-p14.telnet.com.bd.56180 > lamp-s-1vcpu-1gb-tor1-01.ssh: Flags [P.], seq 1:22, ack 42, win 229, options [nop,nop,TS val 3684880717 ecr 2023236715], length 21
04:26:19.924205 IP lamp-s-1vcpu-1gb-tor1-01.ssh > ws44-cashlink-bn-ac1-p14.telnet.com.bd.56180: Flags [.], ack 22, win 227, options [nop,nop,TS val 2023237021 ecr 3684880717], length 0
04:26:19.925893 IP lamp-s-1vcpu-1gb-tor1-01.ssh > ws44-cashlink-bn-ac1-p14.telnet.com.bd.56180: Flags [P.], seq 42:1122, ack 22, win 227, options [nop,nop,TS val 2023237022 ecr 3684880717], length 1080
04:26:20.268796 IP ws44-cashlink-bn-ac1-p14.telnet.com.bd.56180 > lamp-s-1vcpu-1gb-tor1-01.ssh: Flags [.], ack 1122, win 245, options [nop,nop,TS val 3684881060 ecr 2023237022], length 0
04:26:20.358723 IP ws44-cashlink-bn-ac1-p14.telnet.com.bd.56180 > lamp-s-1vcpu-1gb-tor1-01.ssh: Flags [P.], seq 22:462, ack 1122, win 245, options [nop,nop,TS val 3684881149 ecr 2023237022], length 440
04:26:20.402333 IP lamp-s-1vcpu-1gb-tor1-01.ssh > ws44-cashlink-bn-ac1-p14.telnet.com.bd.56180: Flags [.], ack 462, win 235, options [nop,nop,TS val 2023237499 ecr 3684881149], length 0
04:26:20.690329 IP ws44-cashlink-bn-ac1-p14.telnet.com.bd.56180 > lamp-s-1vcpu-1gb-tor1-01.ssh: Flags [P.], seq 462:510, ack 1122, win 245, options [nop,nop,TS val 3684881480 ecr 2023237499], length 48
04:26:20.690392 IP lamp-s-1vcpu-1gb-tor1-01.ssh > ws44-cashlink-bn-ac1-p14.telnet.com.bd.56180: Flags [.], ack 510, win 235, options [nop,nop,TS val 2023237787 ecr 3684881480], length 0
04:26:20.703338 IP lamp-s-1vcpu-1gb-tor1-01.ssh > ws44-cashlink-bn-ac1-p14.telnet.com.bd.56180: Flags [P.], seq 1122:1402, ack 510, win 235, options [nop,nop,TS val 2023237800 ecr 3684881480], length 280
04:26:20.992387 IP ws44-cashlink-bn-ac1-p14.telnet.com.bd.56180 > lamp-s-1vcpu-1gb-tor1-01.ssh: Flags [.], ack 1402, win 262, options [nop,nop,TS val 3684881780 ecr 2023237800], length 0
04:26:22.423543 IP ws44-cashlink-bn-ac1-p14.telnet.com.bd.56180 > lamp-s-1vcpu-1gb-tor1-01.ssh: Flags [P.], seq 510:526, ack 1402, win 262, options [nop,nop,TS val 3684883214 ecr 2023237800], length 16
04:26:22.466334 IP lamp-s-1vcpu-1gb-tor1-01.ssh > ws44-cashlink-bn-ac1-p14.telnet.com.bd.56180: Flags [.], ack 526, win 235, options [nop,nop,TS val 2023239563 ecr 3684883214], length 0
04:26:22.772242 IP ws44-cashlink-bn-ac1-p14.telnet.com.bd.56180 > lamp-s-1vcpu-1gb-tor1-01.ssh: Flags [P.], seq 526:578, ack 1402, win 262, options [nop,nop,TS val 3684883560 ecr 2023239563], length 52
04:26:22.772301 IP lamp-s-1vcpu-1gb-tor1-01.ssh > ws44-cashlink-bn-ac1-p14.telnet.com.bd.56180: Flags [.], ack 578, win 235, options [nop,nop,TS val 2023239869 ecr 3684883560], length 0
04:26:22.772500 IP lamp-s-1vcpu-1gb-tor1-01.ssh > ws44-cashlink-bn-ac1-p14.telnet.com.bd.56180: Flags [P.], seq 1402:1454, ack 578, win 235, options [nop,nop,TS val 2023239869 ecr 3684883560], length 52
04:26:23.064726 IP ws44-cashlink-bn-ac1-p14.telnet.com.bd.56180 > lamp-s-1vcpu-1gb-tor1-01.ssh: Flags [.], ack 1454, win 262, options [nop,nop,TS val 3684883856 ecr 2023239869], length 0
04:26:23.065657 IP ws44-cashlink-bn-ac1-p14.telnet.com.bd.56180 > lamp-s-1vcpu-1gb-tor1-01.ssh: Flags [P.], seq 578:662, ack 1454, win 262, options [nop,nop,TS val 3684883857 ecr 2023239869], length 84
04:26:23.106327 IP lamp-s-1vcpu-1gb-tor1-01.ssh > ws44-cashlink-bn-ac1-p14.telnet.com.bd.56180: Flags [.], ack 662, win 235, options [nop,nop,TS val 2023240203 ecr 3684883857], length 0
04:26:25.275974 IP lamp-s-1vcpu-1gb-tor1-01.ssh > ws44-cashlink-bn-ac1-p14.telnet.com.bd.56180: Flags [P.], seq 1454:1522, ack 662, win 235, options [nop,nop,TS val 2023242373 ecr 3684883857], length 68
04:26:25.580729 IP ws44-cashlink-bn-ac1-p14.telnet.com.bd.56180 > lamp-s-1vcpu-1gb-tor1-01.ssh: Flags [P.], seq 662:714, ack 1522, win 262, options [nop,nop,TS val 3684886370 ecr 2023242373], length 52
04:26:25.580811 IP lamp-s-1vcpu-1gb-tor1-01.ssh > ws44-cashlink-bn-ac1-p14.telnet.com.bd.56180: Flags [.], ack 714, win 235, options [nop,nop,TS val 2023242677 ecr 3684886370], length 0
04:26:25.580855 IP ws44-cashlink-bn-ac1-p14.telnet.com.bd.56180 > lamp-s-1vcpu-1gb-tor1-01.ssh: Flags [F.], seq 714, ack 1522, win 262, options [nop,nop,TS val 3684886370 ecr 2023242373], length 0
04:26:25.585268 IP lamp-s-1vcpu-1gb-tor1-01.ssh > ws44-cashlink-bn-ac1-p14.telnet.com.bd.56180: Flags [F.], seq 1522, ack 715, win 235, options [nop,nop,TS val 2023242682 ecr 3684886370], length 0
04:26:25.892335 IP ws44-cashlink-bn-ac1-p14.telnet.com.bd.56180 > lamp-s-1vcpu-1gb-tor1-01.ssh: Flags [.], ack 1523, win 262, options [nop,nop,TS val 3684886680 ecr 2023242682], length 0
04:26:29.974016 IP 98.143.148.45.53244 > lamp-s-1vcpu-1gb-tor1-01.ssh: Flags [S], seq 2880857368, win 29200, options [mss 1460,sackOK,TS val 1786128348 ecr 0,nop,wscale 7], length 0
04:26:29.974109 IP lamp-s-1vcpu-1gb-tor1-01 > 98.143.148.45: ICMP lamp-s-1vcpu-1gb-tor1-01 tcp port ssh unreachable, length 68
04:26:32.923848 IP 112.158.118.159.38770 > lamp-s-1vcpu-1gb-tor1-01.ssh: Flags [S], seq 1510596212, win 29200, options [mss 1460,sackOK,TS val 1620012575 ecr 0,nop,wscale 7], length 0
04:26:32.923938 IP lamp-s-1vcpu-1gb-tor1-01 > 112.158.118.159: ICMP lamp-s-1vcpu-1gb-tor1-01 tcp port ssh unreachable, length 68
04:26:36.682361 IP lamp-s-1vcpu-1gb-tor1-01.ssh > 167.99.75.206.50342: Flags [P.], seq 0:68, ack 1, win 235, options [nop,nop,TS val 3031291451 ecr 3387706728], length 68
04:26:36.855099 IP 81-227-12-28-no2430.tbcn.telia.com.57863 > lamp-s-1vcpu-1gb-tor1-01.ssh: Flags [S], seq 806501815, win 65535, length 0
04:26:36.855212 IP lamp-s-1vcpu-1gb-tor1-01.ssh > 81-227-12-28-no2430.tbcn.telia.com.57863: Flags [S.], seq 557081005, ack 806501816, win 29200, options [mss 1460], length 0
04:26:36.940100 IP 167.99.75.206.50342 > lamp-s-1vcpu-1gb-tor1-01.ssh: Flags [.], ack 68, win 154, options [nop,nop,TS val 3387791317 ecr 3031291451,nop,nop,sack 1 {0:68}], length 0
04:26:36.940173 IP lamp-s-1vcpu-1gb-tor1-01 > 167.99.75.206: ICMP lamp-s-1vcpu-1gb-tor1-01 tcp port ssh unreachable, length 72
04:26:36.993925 IP 81-227-12-28-no2430.tbcn.telia.com.57863 > lamp-s-1vcpu-1gb-tor1-01.ssh: Flags [R], seq 806501816, win 0, length 0
04:26:43.867943 IP 115.90.219.20.51838 > lamp-s-1vcpu-1gb-tor1-01.ssh: Flags [S], seq 2291560728, win 29200, options [mss 1460,sackOK,TS val 3487381029 ecr 0,nop,wscale 7], length 0
04:26:43.868016 IP lamp-s-1vcpu-1gb-tor1-01 > 115.90.219.20: ICMP lamp-s-1vcpu-1gb-tor1-01 tcp port ssh unreachable, length 68
04:26:44.547588 IP toroon0247w-lp130-11-184-148-73-232.dsl.bell.ca.50361 > lamp-s-1vcpu-1gb-tor1-01.ssh: Flags [P.], seq 1:69, ack 188, win 1024, length 68
04:26:44.590334 IP lamp-s-1vcpu-1gb-tor1-01.ssh > toroon0247w-lp130-11-184-148-73-232.dsl.bell.ca.50361: Flags [.], ack 69, win 319, length 0
04:26:45.680902 IP 185.156.73.54.55443 > lamp-s-1vcpu-1gb-tor1-01.4474: Flags [S], seq 557212576, win 1024, length 0
04:26:48.427115 IP toroon0247w-lp130-11-184-148-73-232.dsl.bell.ca.50361 > lamp-s-1vcpu-1gb-tor1-01.ssh: Flags [P.], seq 69:137, ack 188, win 1024, length 68
04:26:48.427177 IP lamp-s-1vcpu-1gb-tor1-01.ssh > toroon0247w-lp130-11-184-148-73-232.dsl.bell.ca.50361: Flags [.], ack 137, win 319, length 0
04:26:50.788763 IP 183.107.101.240.37540 > lamp-s-1vcpu-1gb-tor1-01.ssh: Flags [S], seq 422122288, win 29200, options [mss 1460,sackOK,TS val 3327088647 ecr 0,nop,wscale 7], length 0
04:26:50.788859 IP lamp-s-1vcpu-1gb-tor1-01.ssh > 183.107.101.240.37540: Flags [S.], seq 2207397815, ack 422122289, win 28960, options [mss 1460,sackOK,TS val 889193358 ecr 3327088647,nop,wscale 7], length 0
04:26:51.788720 IP 183.107.101.240.37540 > lamp-s-1vcpu-1gb-tor1-01.ssh: Flags [S], seq 422122288, win 29200, options [mss 1460,sackOK,TS val 3327089648 ecr 0,nop,wscale 7], length 0
04:26:51.788801 IP lamp-s-1vcpu-1gb-tor1-01.ssh > 183.107.101.240.37540: Flags [S.], seq 2207397815, ack 422122289, win 28960, options [mss 1460,sackOK,TS val 889194358 ecr 3327088647,nop,wscale 7], length 0
04:26:52.810336 IP lamp-s-1vcpu-1gb-tor1-01.ssh > 183.107.101.240.37540: Flags [S.], seq 2207397815, ack 422122289, win 28960, options [mss 1460,sackOK,TS val 889195380 ecr 3327088647,nop,wscale 7], length 0
04:26:53.060951 IP 183.107.101.240.37540 > lamp-s-1vcpu-1gb-tor1-01.ssh: Flags [.], ack 1, win 229, options [nop,nop,TS val 3327090919 ecr 889195380], length 0
04:26:53.073552 IP lamp-s-1vcpu-1gb-tor1-01.ssh > 183.107.101.240.37540: Flags [P.], seq 1:42, ack 1, win 227, options [nop,nop,TS val 889195643 ecr 3327090919], length 41
04:26:53.323449 IP 183.107.101.240.37540 > lamp-s-1vcpu-1gb-tor1-01.ssh: Flags [.], ack 42, win 229, options [nop,nop,TS val 3327091182 ecr 889195643], length 0
04:26:53.325323 IP 183.107.101.240.37540 > lamp-s-1vcpu-1gb-tor1-01.ssh: Flags [P.], seq 1:22, ack 42, win 229, options [nop,nop,TS val 3327091184 ecr 889195643], length 21
04:26:53.325361 IP lamp-s-1vcpu-1gb-tor1-01.ssh > 183.107.101.240.37540: Flags [.], ack 22, win 227, options [nop,nop,TS val 889195895 ecr 3327091184], length 0
04:26:53.327085 IP lamp-s-1vcpu-1gb-tor1-01.ssh > 183.107.101.240.37540: Flags [P.], seq 42:1122, ack 22, win 227, options [nop,nop,TS val 889195896 ecr 3327091184], length 1080
04:26:53.580864 IP 183.107.101.240.37540 > lamp-s-1vcpu-1gb-tor1-01.ssh: Flags [P.], seq 22:462, ack 1122, win 251, options [nop,nop,TS val 3327091440 ecr 889195896], length 440
04:26:53.622316 IP lamp-s-1vcpu-1gb-tor1-01.ssh > 183.107.101.240.37540: Flags [.], ack 462, win 235, options [nop,nop,TS val 889196191 ecr 3327091440], length 0
04:26:53.872907 IP 183.107.101.240.37540 > lamp-s-1vcpu-1gb-tor1-01.ssh: Flags [P.], seq 462:510, ack 1122, win 251, options [nop,nop,TS val 3327091731 ecr 889196191], length 48
04:26:53.872973 IP lamp-s-1vcpu-1gb-tor1-01.ssh > 183.107.101.240.37540: Flags [.], ack 510, win 235, options [nop,nop,TS val 889196442 ecr 3327091731], length 0
04:26:53.884681 IP lamp-s-1vcpu-1gb-tor1-01.ssh > 183.107.101.240.37540: Flags [P.], seq 1122:1402, ack 510, win 235, options [nop,nop,TS val 889196454 ecr 3327091731], length 280
04:26:54.137582 IP 183.107.101.240.37540 > lamp-s-1vcpu-1gb-tor1-01.ssh: Flags [P.], seq 510:526, ack 1402, win 268, options [nop,nop,TS val 3327091996 ecr 889196454], length 16
04:26:54.178303 IP lamp-s-1vcpu-1gb-tor1-01.ssh > 183.107.101.240.37540: Flags [.], ack 526, win 235, options [nop,nop,TS val 889196748 ecr 3327091996], length 0
04:26:54.428831 IP 183.107.101.240.37540 > lamp-s-1vcpu-1gb-tor1-01.ssh: Flags [P.], seq 526:578, ack 1402, win 268, options [nop,nop,TS val 3327092288 ecr 889196748], length 52
04:26:54.428900 IP lamp-s-1vcpu-1gb-tor1-01.ssh > 183.107.101.240.37540: Flags [.], ack 578, win 235, options [nop,nop,TS val 889196998 ecr 3327092288], length 0
04:26:54.429099 IP lamp-s-1vcpu-1gb-tor1-01.ssh > 183.107.101.240.37540: Flags [P.], seq 1402:1454, ack 578, win 235, options [nop,nop,TS val 889196998 ecr 3327092288], length 52
04:26:54.679881 IP 183.107.101.240.37540 > lamp-s-1vcpu-1gb-tor1-01.ssh: Flags [P.], seq 578:694, ack 1454, win 268, options [nop,nop,TS val 3327092538 ecr 889196998], length 116
04:26:54.722265 IP lamp-s-1vcpu-1gb-tor1-01.ssh > 183.107.101.240.37540: Flags [.], ack 694, win 235, options [nop,nop,TS val 889197291 ecr 3327092538], length 0
04:26:56.273373 IP 222.186.31.83.35262 > lamp-s-1vcpu-1gb-tor1-01.ssh: Flags [S], seq 3130225165, win 29200, options [mss 1460,sackOK,TS val 3001923 ecr 0,nop,wscale 7], length 0
04:26:56.273468 IP lamp-s-1vcpu-1gb-tor1-01.ssh > 222.186.31.83.35262: Flags [S.], seq 4182247673, ack 3130225166, win 28960, options [mss 1460,sackOK,TS val 4062724683 ecr 3001923,nop,wscale 7], length 0
04:26:57.160090 IP lamp-s-1vcpu-1gb-tor1-01.ssh > 183.107.101.240.37540: Flags [P.], seq 1454:1522, ack 694, win 235, options [nop,nop,TS val 889199729 ecr 3327092538], length 68
04:26:57.271436 IP 222.186.31.83.35262 > lamp-s-1vcpu-1gb-tor1-01.ssh: Flags [S], seq 3130225165, win 29200, options [mss 1460,sackOK,TS val 3002173 ecr 0,nop,wscale 7], length 0
04:26:57.271500 IP lamp-s-1vcpu-1gb-tor1-01.ssh > 222.186.31.83.35262: Flags [S.], seq 4182247673, ack 3130225166, win 28960, options [mss 1460,sackOK,TS val 4062725681 ecr 3001923,nop,wscale 7], length 0
04:26:57.410010 IP 183.107.101.240.37540 > lamp-s-1vcpu-1gb-tor1-01.ssh: Flags [P.], seq 694:746, ack 1522, win 268, options [nop,nop,TS val 3327095269 ecr 889199729], length 52
04:26:57.410080 IP lamp-s-1vcpu-1gb-tor1-01 > 183.107.101.240: ICMP lamp-s-1vcpu-1gb-tor1-01 tcp port ssh unreachable, length 112
04:26:57.410530 IP 183.107.101.240.37540 > lamp-s-1vcpu-1gb-tor1-01.ssh: Flags [F.], seq 746, ack 1522, win 268, options [nop,nop,TS val 3327095269 ecr 889199729], length 0
04:26:57.410589 IP lamp-s-1vcpu-1gb-tor1-01 > 183.107.101.240: ICMP lamp-s-1vcpu-1gb-tor1-01 tcp port ssh unreachable, length 60
04:26:57.486292 IP 222.186.31.83.35262 > lamp-s-1vcpu-1gb-tor1-01.ssh: Flags [.], ack 1, win 229, options [nop,nop,TS val 3002226 ecr 4062725681], length 0
04:26:57.486396 IP 222.186.31.83.35262 > lamp-s-1vcpu-1gb-tor1-01.ssh: Flags [P.], seq 1:16, ack 1, win 229, options [nop,nop,TS val 3002226 ecr 4062725681], length 15
04:26:57.498632 IP lamp-s-1vcpu-1gb-tor1-01.ssh > 222.186.31.83.35262: Flags [P.], seq 1:42, ack 1, win 227, options [nop,nop,TS val 4062725908 ecr 3002226], length 41
04:26:57.770315 IP lamp-s-1vcpu-1gb-tor1-01.ssh > 183.107.101.240.37540: Flags [P.], seq 1454:1522, ack 694, win 235, options [nop,nop,TS val 889200340 ecr 3327092538], length 68
04:26:58.020852 IP 183.107.101.240.37540 > lamp-s-1vcpu-1gb-tor1-01.ssh: Flags [.], ack 1522, win 268, options [nop,nop,TS val 3327095880 ecr 889200340,nop,nop,sack 1 {1454:1522}], length 0
04:26:58.020922 IP lamp-s-1vcpu-1gb-tor1-01 > 183.107.101.240: ICMP lamp-s-1vcpu-1gb-tor1-01 tcp port ssh unreachable, length 72
04:26:58.154314 IP lamp-s-1vcpu-1gb-tor1-01.ssh > 222.186.31.83.35262: Flags [P.], seq 1:42, ack 1, win 227, options [nop,nop,TS val 4062726564 ecr 3002226], length 41
04:26:58.378308 IP lamp-s-1vcpu-1gb-tor1-01.ssh > 183.107.101.240.37540: Flags [P.], seq 1454:1522, ack 694, win 235, options [nop,nop,TS val 889200948 ecr 3327092538], length 68
04:26:58.826325 IP lamp-s-1vcpu-1gb-tor1-01.ssh > 222.186.31.83.35262: Flags [P.], seq 1:42, ack 1, win 227, options [nop,nop,TS val 4062727236 ecr 3002226], length 41
04:26:59.594345 IP lamp-s-1vcpu-1gb-tor1-01.ssh > 183.107.101.240.37540: Flags [P.], seq 1454:1522, ack 694, win 235, options [nop,nop,TS val 889202164 ecr 3327092538], length 68
04:26:59.885300 IP 183.107.101.240.37540 > lamp-s-1vcpu-1gb-tor1-01.ssh: Flags [F.], seq 746, ack 1522, win 268, options [nop,nop,TS val 3327097744 ecr 889200340], length 0
04:26:59.885380 IP lamp-s-1vcpu-1gb-tor1-01 > 183.107.101.240: ICMP lamp-s-1vcpu-1gb-tor1-01 tcp port ssh unreachable, length 60
04:26:59.915526 IP 222.186.31.83.35262 > lamp-s-1vcpu-1gb-tor1-01.ssh: Flags [P.], seq 1:16, ack 1, win 229, options [nop,nop,TS val 3002834 ecr 4062725681], length 15
04:26:59.915611 IP lamp-s-1vcpu-1gb-tor1-01.ssh > 222.186.31.83.35262: Flags [.], ack 16, win 227, options [nop,nop,TS val 4062728325 ecr 3002834], length 0
04:27:00.138321 IP lamp-s-1vcpu-1gb-tor1-01.ssh > 222.186.31.83.35262: Flags [P.], seq 1:42, ack 16, win 227, options [nop,nop,TS val 4062728548 ecr 3002834], length 41
04:27:02.026314 IP lamp-s-1vcpu-1gb-tor1-01.ssh > 183.107.101.240.37540: Flags [P.], seq 1454:1522, ack 694, win 235, options [nop,nop,TS val 889204596 ecr 3327092538], length 68
04:27:02.276103 IP 183.107.101.240.37540 > lamp-s-1vcpu-1gb-tor1-01.ssh: Flags [.], ack 1522, win 268, options [nop,nop,TS val 3327100135 ecr 889204596,nop,nop,sack 1 {1454:1522}], length 0
04:27:02.276174 IP lamp-s-1vcpu-1gb-tor1-01 > 183.107.101.240: ICMP lamp-s-1vcpu-1gb-tor1-01 tcp port ssh unreachable, length 72
04:27:02.794342 IP lamp-s-1vcpu-1gb-tor1-01.ssh > 222.186.31.83.35262: Flags [P.], seq 1:42, ack 16, win 227, options [nop,nop,TS val 4062731204 ecr 3002834], length 41
04:27:04.108260 IP 180.168.95.234.36030 > lamp-s-1vcpu-1gb-tor1-01.ssh: Flags [S], seq 1516387805, win 29200, options [mss 1460,sackOK,TS val 3031303105 ecr 0,nop,wscale 7], length 0
04:27:04.108342 IP lamp-s-1vcpu-1gb-tor1-01 > 180.168.95.234: ICMP lamp-s-1vcpu-1gb-tor1-01 tcp port ssh unreachable, length 68
04:27:06.028603 IP 183.107.101.240.37540 > lamp-s-1vcpu-1gb-tor1-01.ssh: Flags [FP.], seq 694:746, ack 1522, win 268, options [nop,nop,TS val 3327103888 ecr 889204596], length 52
04:27:06.028674 IP lamp-s-1vcpu-1gb-tor1-01 > 183.107.101.240: ICMP lamp-s-1vcpu-1gb-tor1-01 tcp port ssh unreachable, length 112
04:27:06.890325 IP lamp-s-1vcpu-1gb-tor1-01.ssh > 183.107.101.240.37540: Flags [P.], seq 1454:1522, ack 694, win 235, options [nop,nop,TS val 889209460 ecr 3327092538], length 68
04:27:07.140559 IP 183.107.101.240.37540 > lamp-s-1vcpu-1gb-tor1-01.ssh: Flags [.], ack 1522, win 268, options [nop,nop,TS val 3327104999 ecr 889209460,nop,nop,sack 1 {1454:1522}], length 0
04:27:07.140647 IP lamp-s-1vcpu-1gb-tor1-01 > 183.107.101.240: ICMP lamp-s-1vcpu-1gb-tor1-01 tcp port ssh unreachable, length 72
04:27:07.486757 IP 120-88-46-226.snat21.hns.net.in.42724 > lamp-s-1vcpu-1gb-tor1-01.ssh: Flags [S], seq 4084222725, win 29200, options [mss 1460,sackOK,TS val 3195344349 ecr 0,nop,wscale 7], length 0
04:27:07.486845 IP lamp-s-1vcpu-1gb-tor1-01 > 120-88-46-226.snat21.hns.net.in: ICMP lamp-s-1vcpu-1gb-tor1-01 tcp port ssh unreachable, length 68
04:27:08.170320 IP lamp-s-1vcpu-1gb-tor1-01.ssh > 222.186.31.83.35262: Flags [P.], seq 1:42, ack 16, win 227, options [nop,nop,TS val 4062736580 ecr 3002834], length 41
04:27:08.343485 IP lamp-s-1vcpu-1gb-tor1-01.ssh > 121.137.106.165.42194: Flags [F.], seq 68, ack 1, win 235, options [nop,nop,TS val 47542265 ecr 145608036], length 0
04:27:10.273711 IP 218.92.0.211.37854 > lamp-s-1vcpu-1gb-tor1-01.ssh: Flags [S], seq 4117230193, win 29200, options [mss 1460,sackOK,TS val 605052603 ecr 0,nop,wscale 7], length 0
04:27:10.273824 IP lamp-s-1vcpu-1gb-tor1-01.ssh > 218.92.0.211.37854: Flags [S.], seq 937126747, ack 4117230194, win 28960, options [mss 1460,sackOK,TS val 901288316 ecr 605052603,nop,wscale 7], length 0
04:27:10.367186 IP lamp-s-1vcpu-1gb-tor1-01.ssh > 167.99.75.206.50342: Flags [F.], seq 68, ack 1, win 235, options [nop,nop,TS val 3031325137 ecr 3387706728], length 0
04:27:10.625230 IP 167.99.75.206.50342 > lamp-s-1vcpu-1gb-tor1-01.ssh: Flags [R], seq 83522765, win 0, length 0
04:27:10.625307 IP lamp-s-1vcpu-1gb-tor1-01 > 167.99.75.206: ICMP lamp-s-1vcpu-1gb-tor1-01 tcp port ssh unreachable, length 48
04:27:11.272906 IP 218.92.0.211.37854 > lamp-s-1vcpu-1gb-tor1-01.ssh: Flags [S], seq 4117230193, win 29200, options [mss 1460,sackOK,TS val 605052853 ecr 0,nop,wscale 7], length 0
04:27:11.272997 IP lamp-s-1vcpu-1gb-tor1-01.ssh > 218.92.0.211.37854: Flags [S.], seq 937126747, ack 4117230194, win 28960, options [mss 1460,sackOK,TS val 901289316 ecr 605052603,nop,wscale 7], length 0
04:27:12.298347 IP lamp-s-1vcpu-1gb-tor1-01.ssh > 218.92.0.211.37854: Flags [S.], seq 937126747, ack 4117230194, win 28960, options [mss 1460,sackOK,TS val 901290341 ecr 605052603,nop,wscale 7], length 0
^C04:27:12.358977 IP 185.176.27.42.56959 > lamp-s-1vcpu-1gb-tor1-01.6359: Flags [S], seq 1720464722, win 1024, length 0